Libelle;docID;tid;Type;Value;Mod;temporalFunction;functionInDocument;beginPoint;endPoint;quant;freq;anchorTimeID
1998-08-07;APW19980807.0261;t0;TIME;1998-08-07;;false;CREATION_TIME;;;;;
Friday;APW19980807.0261;t1;DATE;1998-08-07;;false;NONE;;;;;
1998-08-08;APW19980808.0022;t0;TIME;1998-08-08;;false;CREATION_TIME;;;;;
Saturday;APW19980808.0022;t1;DATE;1998-08-08;;false;NONE;;;;;
Friday;APW19980808.0022;t2;DATE;1998-08-07;;false;NONE;;;;;
10:35 a.m.;APW19980808.0022;t4;TIME;1998-08-07T10:35;;false;NONE;;;;;
Friday;APW19980808.0022;t3;DATE;1998-08-07;;false;NONE;;;;;
1998-08-09;APW19980809.0700;t0;TIME;1998-08-09;;false;CREATION_TIME;;;;;
Saturday;APW19980809.0700;t1;DATE;1998-08-08;;false;NONE;;;;;
1998-08-10;APW19980810.0907;t0;TIME;1998-08-10;;false;CREATION_TIME;;;;;
Monday;APW19980810.0907;t1;DATE;1998-08-10;;false;NONE;;;;;
1998-08-11;APW19980811.0474;t0;TIME;1998-08-11;;false;CREATION_TIME;;;;;
Tuesday;APW19980811.0474;t4;DATE;1998-08-11;;false;NONE;;;;;
last week;APW19980811.0474;t5;DURATION;1998-08-04;;false;NONE;;;;;t5
1998-08-13;APW19980813.1117;t0;TIME;1998-08-13;;false;CREATION_TIME;;;;;
Thursday;APW19980813.1117;t1;DATE;1998-08-13;;false;NONE;;;;;
Aug. 7;APW19980813.1117;t2;DATE;1998-08-07;;false;NONE;;;;;
Aug. 7;APW19980813.1117;t3;DATE;1998-08-07;;false;NONE;;;;;
1998-08-18;APW19980818.0515;t0;TIME;1998-08-18;;false;CREATION_TIME;;;;;
Tuesday;APW19980818.0515;t1;DATE;1998-08-18;;false;NONE;;;;;
Aug. 7;APW19980818.0515;t2;DATE;1998-08-07;;false;NONE;;;;;
Monday;APW19980818.0515;t3;DATE;1998-08-17;;false;NONE;;;;;
three days;APW19980818.0515;t4;DURATION;P3D;;true;NONE;;;;;
16-hour;APW19980818.0515;t9;DURATION;PT16H;;true;NONE;;;;;
five hours;APW19980818.0515;t5;DURATION;PT5H;;false;NONE;;;;;
five-hour;APW19980818.0515;t10;DURATION;PT5H;;true;NONE;;;;;
now;APW19980818.0515;t6;DATE;PRESENT_REF;;true;NONE;;;;;
last week;APW19980818.0515;t7;DATE;P1W;;false;NONE;;;;;t3
today;APW19980818.0515;t8;DATE;1998-08-18;;false;NONE;;;;;
1998-08-20;APW19980820.1428;t0;TIME;1998-08-20;;false;CREATION_TIME;;;;;
Friday;APW19980820.1428;t1;DATE;1998-08-07;;false;NONE;;;;;
this month;APW19980820.1428;t2;DURATION;P1M;;false;NONE;;;;;t1
Thursday;APW19980820.1428;t3;DATE;1998-08-20;;false;NONE;;;;;
Aug. 7;APW19980820.1428;t4;DATE;1998-08-07;;false;NONE;;;;;
1998-08-26;APW19980826.0389;t0;TIME;1998-08-26;;false;CREATION_TIME;;;;;
Wednesday;APW19980826.0389;t1;DATE;1998-08-26;;;NONE;;;;;
Aug. 7;APW19980826.0389;t2;DATE;1998-08-07;;;NONE;;;;;
Wednesday;APW19980826.0389;t3;DATE;1998-08-26;;;NONE;;;;;
September;APW19980826.0389;t4;DURATION;P1M;;;NONE;;;;;
Wednesday;APW19980826.0389;t5;DATE;1998-08-26;;;NONE;;;;;
1998-09-11;APW19980911.0475;t0;TIME;1998-09-11;;false;CREATION_TIME;;;;;
last month;APW19980911.0475;t1;DATE;1998-08;;false;NONE;;;;;
Friday;APW19980911.0475;t2;DATE;1998-09-11;;false;NONE;;;;;
Aug. 7;APW19980911.0475;t3;DATE;1998-08-07;;false;NONE;;;;;
Sunday;APW19980911.0475;t4;DATE;1998-09-06;;false;NONE;;;;;
Sept. 2;APW19980911.0475;t5;DATE;1998-09-02;;false;NONE;;;;;
1998-09-30;APW19980930.0425;t0;TIME;1998-09-30;;false;CREATION_TIME;;;;;
Wednesday;APW19980930.0425;t1;DATE;1998-09-30;;false;NONE;;;;;
future;APW19980930.0425;t7;DATE;FUTURE_REF;;true;NONE;;;;;
Aug. 7;APW19980930.0425;t3;DATE;1998-08-07;;false;NONE;;;;;
1995;APW19980930.0425;t4;DATE;1995;;false;NONE;;;;;
Thursday;APW19980930.0425;t5;DATE;1998-10-01;;false;NONE;;;;;
Friday;APW19980930.0425;t6;DATE;1998-09-25;;false;NONE;;;;;
12/05/1998 09:42:00;APW19981205.0374;t0;TIME;1998-12-05T09:42;;false;CREATION_TIME;;;;;
Saturday;APW19981205.0374;t2;DATE;1998-12-05;;true;NONE;;;;;
early this week;APW19981205.0374;t3;DATE;1998-12-XX;;true;NONE;;;;;t0
April;APW19981205.0374;t4;DATE;1999-04;;true;NONE;;;;;
April;APW19981205.0374;t5;DATE;1999-04;;true;NONE;;;;;
two-day;APW19981205.0374;t6;DURATION;P2D;;true;NONE;;;;;
1999-01-22 13:06:18;APW19990122.0193;t0;TIME;1999-01-22T13:06;;false;CREATION_TIME;;;;;
Friday;APW19990122.0193;t2;DATE;1999-01-22;;true;NONE;;;;;
last year;APW19990122.0193;t3;DATE;1998-10;;true;NONE;;;;;
Oct. 23;APW19990122.0193;t4;DATE;1998-10-23;;true;NONE;;;;;
last three years;APW19990122.0193;t5;SET;P1Y;;true;NONE;;;EACH;1X;
Friday;APW19990122.0193;t6;DATE;1999-01-22;;true;NONE;;;;;
Last week;APW19990122.0193;t7;DATE;1999-01;;true;NONE;;;;;
weeks;APW19990122.0193;t8;DATE;1998-10;;true;NONE;;;;;
last month;APW19990122.0193;t9;DATE;1998-12;;true;NONE;;;;;
two weeks;APW19990122.0193;t11;DURATION;P2W;APPROX;false;NONE;;;;;
1999-02-06 06:22:26;APW19990206.0090;t0;TIME;1999-02-06T06:22;;false;CREATION_TIME;;;;;
Friday;APW19990206.0090;t2;DATE;1999-02-05;;true;NONE;;;;;
this week;APW19990206.0090;t3;DATE;1999-02;;true;NONE;;;;;
Thursday;APW19990206.0090;t4;DATE;1999-02-04;;true;NONE;;;;;
last October;APW19990206.0090;t5;DATE;1998-10;;true;NONE;;;;;
that same day.;APW19990206.0090;t6;DATE;1998-10-XX;;true;NONE;;;;;
Friday;APW19990206.0090;t7;DATE;1999-02-05;;true;NONE;;;;;
1999-02-16 12:55:33;APW19990216.0198;t0;TIME;1999-02-16T12:55;;false;CREATION_TIME;;;;;
March 12;APW19990216.0198;t2;DATE;1999-03-12;;true;NONE;;;;;
50 years ago;APW19990216.0198;t4;DATE;1949-XX;;true;NONE;;;;;
1999-03-12 10:34:13;APW19990312.0251;t0;TIME;1999-03-12T10:34;;false;CREATION_TIME;;;;;
today;APW19990312.0251;t2;DATE;1999-03-12;;true;NONE;;;;;
less than a decade;APW19990312.0251;t4;DURATION;PXY;;true;NONE;;t2;;;
a decade ago;APW19990312.0251;t6;DATE;1989-XX;;true;NONE;;;;;t0
1968;APW19990312.0251;t7;DATE;1968-XX;;false;NONE;;;;;
today;APW19990312.0251;t8;DATE;1999-03-12;;true;NONE;;;;;
1949;APW19990312.0251;t9;DATE;1949-XX;;false;NONE;;;;;
1952;APW19990312.0251;t10;DATE;1952-XX;;false;NONE;;;;;
1955;APW19990312.0251;t11;DATE;1955-XX;;false;NONE;;;;;
1982;APW19990312.0251;t12;DATE;1982-XX;;false;NONE;;;;;
April;APW19990312.0251;t13;DATE;1999-04;;true;NONE;;;;;
1949;APW19990312.0251;t14;DATE;1949-XX;;false;NONE;;;;;
March 5, 1946;APW19990312.0251;t15;DATE;1946-03-05;;false;NONE;;;;;
almost four years ago;APW19990312.0251;t16;DATE;1995;;true;NONE;;;;;t0
A decade ago;APW19990312.0251;t17;DATE;1989-XX;;true;NONE;;;;;t0
this century;APW19990312.0251;t20;DATE;P100Y;;true;NONE;;;;;t0
1999-04-10 06:27:43;APW19990410.0123;t0;TIME;1999-04-10T06:27;;false;CREATION_TIME;;;;;
last fall;APW19990410.0123;t2;DATE;1998-FA;;true;NONE;;;;;
Friday;APW19990410.0123;t3;DATE;1999-04-09;;true;NONE;;;;;
Thursday;APW19990410.0123;t4;DATE;1999-04-08;;true;NONE;;;;;
days;APW19990410.0123;t5;DATE;1998-FA;;true;NONE;;;;;
December;APW19990410.0123;t6;DATE;1998-12;;true;NONE;;;;;
1999-05-06 15:05:11;APW19990506.0155;t0;TIME;1999-05-06T15:05;;false;CREATION_TIME;;;;;
Thursday;APW19990506.0155;t2;DATE;1999-05-06;;true;NONE;;;;;
Oct. 23;APW19990506.0155;t3;DATE;1998-10-23;;true;NONE;;;;;
Thursday;APW19990506.0155;t4;DATE;1999-05-06;;true;NONE;;;;;
November;APW19990506.0155;t5;DATE;1998-11;;true;NONE;;;;;
1990;APW19990506.0155;t6;DATE;1990;;false;NONE;;;;;
weeks;APW19990506.0155;t7;DATE;1998-10;;true;NONE;;;;;
December;APW19990506.0155;t8;DATE;1998-12;;true;NONE;;;;;
Thursday;APW19990506.0155;t9;DATE;1999-05-06;;true;NONE;;;;;
January 1998;APW19990506.0155;t10;DATE;1998-01;;false;NONE;;;;;
1996;APW19990506.0155;t11;DATE;1996;;false;NONE;;;;;
1999-05-07 03:44:53;APW19990507.0207;t0;TIME;1999-05-07T03:44;;false;CREATION_TIME;;;;;
last fall;APW19990507.0207;t2;DATE;1998-FA;;true;NONE;;;;;
Today;APW19990507.0207;t3;DATE;1999-05-07;;true;NONE;;;;;
November;APW19990507.0207;t4;DATE;1998-11;;true;NONE;;;;;
Thursday;APW19990507.0207;t5;DATE;1999-05-06;;true;NONE;;;;;
Nov. 3;APW19990507.0207;t6;DATE;1998-11-03;;true;NONE;;;;;
Thursday;APW19990507.0207;t7;DATE;1999-05-06;;true;NONE;;;;;
last month;APW19990507.0207;t8;DATE;1999-04;;true;NONE;;;;;
1990;APW19990507.0207;t9;DATE;1990;;false;NONE;;;;;
weeks;APW19990507.0207;t10;DATE;1998-FA;;true;NONE;;;;;
December;APW19990507.0207;t11;DATE;1998-12;;true;NONE;;;;;
1994;APW19990507.0207;t12;DATE;1994;;false;NONE;;;;;
1997;APW19990507.0207;t13;DATE;1997;;false;NONE;;;;;
January 1998;APW19990507.0207;t14;DATE;1998-01;;false;NONE;;;;;
1996;APW19990507.0207;t15;DATE;1996;;false;NONE;;;;;
1999-06-07 19:00:11;APW19990607.0041;t0;TIME;1999-06-07T19:00;;false;CREATION_TIME;;;;;
Monday;APW19990607.0041;t2;DATE;1999-06-07;;true;NONE;;;;;
Aug. 7, 1998;APW19990607.0041;t3;DATE;1998-08-07;;false;NONE;;;;;
last fall;APW19990607.0041;t4;DATE;1998-FA;;true;NONE;;;;;
past 20 years;APW19990607.0041;t5;DURATION;P20Y;;true;NONE;;t0;;;
Dec. 21, 1988;APW19990607.0041;t6;DATE;1988-12-21;;false;NONE;;;;;
April;APW19990607.0041;t7;DATE;1999-04;;true;NONE;;;;;
1950;APW19990607.0041;t8;DATE;1950;;false;NONE;;;;;
1999-10-08;APW19991008.0151;t0;TIME;1999-10-08;;false;CREATION_TIME;;;;;
last year;APW19991008.0151;t1;DATE;1998;;false;NONE;;;;;
midday;APW19991008.0151;t2;TIME;1999-10-08T12:00;;true;NONE;;;;;
today;APW19991008.0151;t3;DATE;1999-10-08;;false;NONE;;;;;
Aug. 7, 1998;APW19991008.0151;t4;DATE;1998-08-07;;false;NONE;;;;;
Thursday morning;APW19991008.0151;t5;DATE;1999-10-07;;false;NONE;;;;;
1999-10-08;APW19991008.0265;t0;TIME;1999-10-08;;false;CREATION_TIME;;;;;
last year;APW19991008.0265;t1;DATE;1998;;false;NONE;;;;;
today;APW19991008.0265;t2;DATE;1999-10-08;;false;NONE;;;;;
today;APW19991008.0265;t3;DATE;1999-10-08;;false;NONE;;;;;
today;APW19991008.0265;t4;DATE;1999-10-08;;false;NONE;;;;;
today;APW19991008.0265;t5;DATE;1999-10-08;;false;NONE;;;;;
Aug. 7, 1998;APW19991008.0265;t6;DATE;1998-08-07;;false;NONE;;;;;
1999-10-24 20:00:09;APW19991024.0075;t0;TIME;1999-10-24T20:00;;false;CREATION_TIME;;;;;
Sunday;APW19991024.0075;t2;DATE;1999-10-24;;true;NONE;;;;;
one year;APW19991024.0075;t3;DURATION;P1Y;;false;NONE;;;;;
1998;APW19991024.0075;t4;DATE;1998;;false;NONE;;;;;
tonight;APW19991024.0075;t5;DATE;1999-10-24;;true;NONE;;;;;
Saturday;APW19991024.0075;t6;DATE;1999-10-23;;true;NONE;;;;;
Oct. 23, 1999;APW19991024.0075;t7;DATE;1999-10-23;;false;NONE;;;;;
Earlier that day;APW19991024.0075;t8;DATE;1998-10-23;;true;NONE;;;;;
May 6;APW19991024.0075;t9;DATE;1999-05-06;;true;NONE;;;;;
Sunday;APW19991024.0075;t10;DATE;1999-10-24;;true;NONE;;;;;
1993;APW19991024.0075;t11;DATE;1993;;false;NONE;;;;;
1998-08-17;APW199980817.1193;t0;DATE;1998-08-17;;false;CREATION_TIME;;;;;
Tuesday;APW199980817.1193;t1;DATE;1998-08-18;;false;NONE;;;;;
Monday;APW199980817.1193;t2;DATE;1998-08-17;;false;NONE;;;;;
16-hour;APW199980817.1193;t11;DURATION;PT16H;;true;NONE;;;;;
five hours;APW199980817.1193;t12;DURATION;PT5H;;true;NONE;;;;;
Tuesday morning;APW199980817.1193;t3;DATE;1998-08-18;;false;NONE;;;;;
5 1/2 hours;APW199980817.1193;t13;DURATION;PT5H30M;;true;NONE;;;;;
Friday;APW199980817.1193;t5;DATE;1998-08-14;;false;NONE;;;;;
one-day;APW199980817.1193;t14;DURATION;P1D;;true;NONE;;;;;
Sunday;APW199980817.1193;t6;DATE;1998-08-16;;false;NONE;;;;;
Aug. 7;APW199980817.1193;t7;DATE;1998-08-07;;false;NONE;;;;;
the weekend;APW199980817.1193;t8;DURATION;P2D;;true;NONE;;;;;t6
Monday;APW199980817.1193;t9;DATE;1998-08-17;;false;NONE;;;;;
last week;APW199980817.1193;t10;DURATION;P1W;;false;NONE;;;;;t7
2000-01-06;APW20000106.0064;t0;TIME;2000-01-06;;false;CREATION_TIME;;;;;
Wednesday night;APW20000106.0064;t1;DATE;2000-01-05;;false;NONE;;;;;
now;APW20000106.0064;t2;DATE;PRESENT_REF;;true;NONE;;;;;
one minute;APW20000106.0064;t3;DURATION;PT1M;;true;NONE;;;;;
late November;APW20000106.0064;t4;DATE;1999-11;END;false;NONE;;;;;
Wednesday;APW20000106.0064;t5;DATE;2000-01-05;;false;NONE;;;;;
Jan. 14;APW20000106.0064;t6;DATE;2000-01-14;;false;NONE;;;;;
Wednesday;APW20000106.0064;t7;DATE;2000-01-05;;false;NONE;;;;;
2000-01-07;APW20000107.0088;t0;TIME;2000-01-07;;false;CREATION_TIME;;;;;
Thursday;APW20000107.0088;t1;DATE;2000-01-06;;false;NONE;;;;;
weeks;APW20000107.0088;t13;DURATION;PXW;;false;NONE;;;;;
daily;APW20000107.0088;t2;SET;P1D;;false;NONE;;;;1X;
40 years;APW20000107.0088;t4;DURATION;P40Y;;false;NONE;;;;;
Wednesday;APW20000107.0088;t5;DATE;2000-01-05;;false;NONE;;;;;
Jan. 14;APW20000107.0088;t6;DATE;2000-01-14;;false;NONE;;;;;
now;APW20000107.0088;t7;DATE;PRESENT_REF;;true;NONE;;;;;
Wednesday;APW20000107.0088;t8;DATE;2000-01-05;;false;NONE;;;;;
one minute;APW20000107.0088;t9;DURATION;PT1M;;false;NONE;;;;;
Wednesday night;APW20000107.0088;t10;DATE;2000-01-05TEV;;false;NONE;;;;;
Nov. 25;APW20000107.0088;t11;DATE;1999-11-25;;false;NONE;;;;;
Wednesday;APW20000107.0088;t12;DATE;2000-01-05;;false;NONE;;;;;
2000-01-07;APW20000107.0318;t0;TIME;2000-01-07;;false;CREATION_TIME;;;;;
Friday;APW20000107.0318;t1;DATE;2000-01-07;;false;NONE;;;;;
Feb. 10;APW20000107.0318;t2;DATE;2000-02-10;;false;NONE;;;;;
Thanksgiving Day;APW20000107.0318;t3;DATE;1999-11-25;;false;NONE;;;;;
Wednesday;APW20000107.0318;t4;DATE;2000-01-05;;false;NONE;;;;;
Jan. 14;APW20000107.0318;t5;DATE;2000-01-14;;false;NONE;;;;;
1996;APW20000107.0318;t20;DATE;1996;;false;NONE;;;;;
1959;APW20000107.0318;t21;DATE;1959;;false;NONE;;;;;
now;APW20000107.0318;t6;DATE;PRESENT_REF;;true;NONE;;;;;
Feb. 10;APW20000107.0318;t7;DATE;2000-02-10;;false;NONE;;;;;
Friday;APW20000107.0318;t8;DATE;2000-01-07;;false;NONE;;;;;
early next week;APW20000107.0318;t9;DURATION;2000-W2;START;false;NONE;;;;;
Friday night;APW20000107.0318;t10;DATE;2000-01-07TEV;;false;NONE;;;;;
Friday;APW20000107.0318;t11;DATE;2000-01-07;;false;NONE;;;;;
Friday;APW20000107.0318;t12;DATE;2000-01-07;;false;NONE;;;;;
Thursday;APW20000107.0318;t13;DATE;2000-01-06;;false;NONE;;;;;
Friday;APW20000107.0318;t14;DATE;2000-01-07;;false;NONE;;;;;
Friday night;APW20000107.0318;t15;DATE;2000-01-07;;false;NONE;;;;;
Saturday;APW20000107.0318;t16;DATE;2000-01-08;;false;NONE;;;;;
Monday;APW20000107.0318;t17;DATE;2000-01-10;;false;NONE;;;;;
early December;APW20000107.0318;t18;DATE;1999-12;START;false;NONE;;;;;
Friday;APW20000107.0318;t19;DATE;2000-01-07;;false;NONE;;;;;
2000-01-15;APW20000115.0031;t0;TIME;2000-01-15;;false;CREATION_TIME;;;;;
Friday;APW20000115.0031;t1;DATE;2000-01-14;;false;NONE;;;;;
early December;APW20000115.0031;t3;DATE;1999-12;START;false;NONE;;;;;
41 years ago;APW20000115.0031;t4;DATE;1959;;false;NONE;;;;;
Nov. 25;APW20000115.0031;t5;DATE;1999-11-25;;false;NONE;;;;;
Friday;APW20000115.0031;t6;DATE;2000-01-14;;false;NONE;;;;;
this week;APW20000115.0031;t7;DATE;P1W;;true;NONE;;;;;t1
one minute;APW20000115.0031;t8;DURATION;PT1M;;true;NONE;;;;;
decades-long;APW20000115.0031;t10;DURATION;PXY;;false;NONE;;;;;
March 6;APW20000115.0031;t9;DATE;2000-03-06;;false;NONE;;;;;
2000-01-15;APW20000115.0209;t0;TIME;2000-01-15;;false;CREATION_TIME;;;;;
Thursday;APW20000115.0209;t1;DATE;2000-01-06;;false;NONE;;;;;
weeks;APW20000115.0209;t13;DURATION;PXW;;false;NONE;;;;;
daily;APW20000115.0209;t2;SET;P1D;;false;NONE;;;;1X;
40 years;APW20000115.0209;t4;DURATION;P40Y;;false;NONE;;;;;
Wednesday;APW20000115.0209;t5;DATE;2000-01-05;;false;NONE;;;;;
Jan. 14;APW20000115.0209;t6;DATE;2000-01-14;;false;NONE;;;;;
now;APW20000115.0209;t7;DATE;PRESENT_REF;;true;NONE;;;;;
Wednesday;APW20000115.0209;t8;DATE;2000-01-05;;false;NONE;;;;;
one minute;APW20000115.0209;t9;DURATION;PT1M;;false;NONE;;;;;
Wednesday night;APW20000115.0209;t10;DATE;2000-01-05TEV;;false;NONE;;;;;
Nov. 25;APW20000115.0209;t11;DATE;1999-11-25;;false;NONE;;;;;
Wednesday;APW20000115.0209;t12;DATE;2000-01-05;;false;NONE;;;;;
2000-01-24 19:48;APW20000124.0182;t0;TIME;2000-01-24T19:48;;false;CREATION_TIME;;;;;
Monday;APW20000124.0182;t2;DATE;2000-01-24;;true;NONE;;;;;
Monday;APW20000124.0182;t3;DATE;2000-01-24;;true;NONE;;;;;
1995;APW20000124.0182;t4;DATE;1995;;false;NONE;;;;;
last year;APW20000124.0182;t5;DATE;1999;;true;NONE;;;;;
October 1998;APW20000124.0182;t6;DATE;1998-10;;false;NONE;;;;;
past 20 years;APW20000124.0182;t7;DURATION;P20Y;;false;NONE;;t0;;;
last year;APW20000124.0182;t8;DATE;1999;;true;NONE;;;;;
1950;APW20000124.0182;t9;DATE;1950;;false;NONE;;;;;
2000-01-28;APW20000128.0316;t0;TIME;2000-01-28;;false;CREATION_TIME;;;;;
Friday;APW20000128.0316;t1;DATE;2000-01-28;;false;NONE;;;;;
June 1998;APW20000128.0316;t2;DATE;1998-06;;false;NONE;;;;;
later that year;APW20000128.0316;t22;DATE;1998;;false;NONE;;;;;
late-November;APW20000128.0316;t19;DATE;1999-11;;false;NONE;;;;;
Friday;APW20000128.0316;t4;DATE;2000-01-28;;false;NONE;;;;;
Friday;APW20000128.0316;t5;DATE;2000-01-28;;false;NONE;;;;;
two months ago;APW20000128.0316;t6;DATE;1999-11;;false;NONE;;;;;
annually;APW20000128.0316;t8;SET;P1Y;;true;NONE;;;;1X;
1898;APW20000128.0316;t9;DATE;1898;;false;NONE;;;;;
this year;APW20000128.0316;t10;DATE;2000;;false;NONE;;;;;
Friday morning;APW20000128.0316;t11;DATE;2000-01-28TMO;;false;NONE;;;;;
every day;APW20000128.0316;t12;SET;P1D;;true;NONE;;;;1X;
Nov. 25;APW20000128.0316;t13;DATE;1999-11-25;;false;NONE;;;;;
the past two months;APW20000128.0316;t21;DURATION;P2M;;false;NONE;t13;;;;
Wednesday;APW20000128.0316;t16;DATE;2000-01-26;;false;NONE;;;;;
Friday;APW20000128.0316;t17;DATE;2000-01-28;;false;NONE;;;;;
2000-02-10;APW20000210.0328;t0;TIME;2000-02-10;;false;CREATION_TIME;;;;;
Thursday;APW20000210.0328;t1;DATE;2000-02-10;;false;NONE;;;;;
last week;APW20000210.0328;t2;DATE;2000-W7;;false;NONE;;;;;
Thursday;APW20000210.0328;t3;DATE;2000-02-10;;false;NONE;;;;;
this week;APW20000210.0328;t4;DATE;2000-W6;;false;NONE;;;;;
Thursday;APW20000210.0328;t5;DATE;2000-02-10;;false;NONE;;;;;
Thursday;APW20000210.0328;t6;DATE;2000-02-10;;false;NONE;;;;;
this month;APW20000210.0328;t7;DATE;2000-02;;false;NONE;;;;;
future;APW20000210.0328;t8;DATE;FUTURE_REF;;true;NONE;;;;;t1
Thursday;APW20000210.0328;t9;DATE;2000-02-10;;false;NONE;;;;;
daily;APW20000210.0328;t10;SET;P1D;;true;NONE;;;;1X;
last Thanksgiving;APW20000210.0328;t11;DATE;1999-11-25;;false;NONE;;;;;
now;APW20000210.0328;t12;DATE;PRESENT_REF;;true;NONE;;;;;t1
1991;APW20000210.0328;t13;DATE;1991;;false;NONE;;;;;
1997;APW20000210.0328;t14;DATE;1997;;false;NONE;;;;;
Wednesday;APW20000210.0328;t15;DATE;2000-02-09;;false;NONE;;;;;
the future;APW20000210.0328;t16;DATE;FUTURE_REF;;true;NONE;;;;;t1
daily;APW20000210.0328;t17;SET;P1D;;true;NONE;;;;1X;
Thursday;APW20000210.0328;t18;DATE;2000-02-10;;false;NONE;;;;;
the future;APW20000210.0328;t19;DATE;FUTURE_REF;;true;NONE;;;;;t1
Feb. 4.;APW20000210.0328;t21;DATE;2000-02-04;;false;NONE;;;;;
2000-02-16;APW20000216.0193;t0;TIME;2000-02-16;;false;CREATION_TIME;;;;;
Wednesday;APW20000216.0193;t1;DATE;2000-02-16;;true;NONE;;;;;
daily;APW20000216.0193;t2;SET;P1D;;true;NONE;;;;1X;
daily;APW20000216.0193;t3;SET;P1D;;true;NONE;;;;1X;
this week;APW20000216.0193;t4;DATE;2000-W7;;false;NONE;;;;;
two weeks;APW20000216.0193;t5;DURATION;P2W;ON_OR_BEFORE;true;NONE;;;;;t1
Tuesday;APW20000216.0193;t6;DATE;2000-02-15;;false;NONE;;;;;
Monday;APW20000216.0193;t7;DATE;2000-02-14;;false;NONE;;;;;
Nov. 25;APW20000216.0193;t8;DATE;1999-11-25;;false;NONE;;;;;
Monday;APW20000216.0193;t9;DATE;2000-02-14;;false;NONE;;;;;
last month;APW20000216.0193;t10;DATE;2000-01;;false;NONE;;;;;
2000-02-16;APW20000216.0272;t0;TIME;2000-02-16;;false;CREATION_TIME;;;;;
Wednesday;APW20000216.0272;t1;DATE;2000-02-16;;false;NONE;;;;;
daily;APW20000216.0272;t2;DATE;P1D;;true;NONE;;;;1X;
daily;APW20000216.0272;t3;DATE;P1D;;true;NONE;;;;1X;
42 years ago;APW20000216.0272;t4;DATE;1958;;false;NONE;;;;;
Wednesday night;APW20000216.0272;t5;DATE;2000-02-16TNI;;false;NONE;;;;;
this week;APW20000216.0272;t6;DATE;2000-W7;;false;NONE;;;;;
two weeks;APW20000216.0272;t7;DURATION;P2W;ON_OR_BEFORE;true;NONE;;;;;t1
Tuesday;APW20000216.0272;t8;DATE;2000-02-15;;false;NONE;;;;;
Monday;APW20000216.0272;t9;DATE;2000-02-14;;false;NONE;;;;;
Nov. 25;APW20000216.0272;t10;DATE;1999-11-25;;false;NONE;;;;;
Monday;APW20000216.0272;t11;DATE;2000-02-14;;false;NONE;;;;;
last month;APW20000216.0272;t12;DATE;2000-01;;false;NONE;;;;;
2000-03-28;APW20000328.0257;t0;TIME;2000-03-28;;false;CREATION_TIME;;;;;
Tuesday;APW20000328.0257;t1;DATE;2000-03-28;;false;NONE;;;;;
Sunday night;APW20000328.0257;t2;DATE;2000-03-26TNI;;false;NONE;;;;;
Tuesday;APW20000328.0257;t3;DATE;2000-03-28;;false;NONE;;;;;
2000-04-01;APW20000401.0150;t0;TIME;2000-04-01;;false;CREATION_TIME;;;;;
more than four decades ago;APW20000401.0150;t2;DURATION;P40Y;MORE_THAN;true;NONE;;t3;;;
Saturday;APW20000401.0150;t3;DATE;2000-04-01;;false;NONE;;;;;
Dec. 2, 1956;APW20000401.0150;t4;DATE;1956-12-02;;false;NONE;;;;;
years;APW20000401.0150;t8;DURATION;PXY;;true;NONE;;;;;
Jan. 1, 1959;APW20000401.0150;t5;DATE;1959-01-01;;false;NONE;;;;;
late November;APW20000401.0150;t6;DATE;1999-11;END;false;NONE;;;;;
today;APW20000401.0150;t7;DATE;2000-04-01;;false;NONE;;;;;
2000-04-03;APW20000403.0057;t0;TIME;2000-04-03;;false;CREATION_TIME;;;;;
today;APW20000403.0057;t1;DATE;2000-04-03;;false;NONE;;;;;
today;APW20000403.0057;t2;DATE;2000-04-03;;false;NONE;;;;;
Tuesday;APW20000403.0057;t3;DATE;2000-04-05;;false;NONE;;;;;
Sunday;APW20000403.0057;t4;DATE;2000-04-02;;false;NONE;;;;;
tomorrow;APW20000403.0057;t5;DATE;2000-04-04;;false;NONE;;;;;
a month;APW20000403.0057;t6;DURATION;P1M;;true;NONE;;;;;
late November;APW20000403.0057;t7;DATE;1999-11;END;false;NONE;;;;;
9 a.m. Tuesday;APW20000403.0057;t8;DATE;2000-04-04T09:00;;false;NONE;;;;;
Sunday night;APW20000403.0057;t9;DATE;2000-04-02TNI;;false;NONE;;;;;
2000-04-05;APW20000405.0276;t0;TIME;2000-04-05;;false;CREATION_TIME;;;;;
Wednesday night;APW20000405.0276;t1;DATE;2000-04-05TNI;;false;NONE;;;;;
three days;APW20000405.0276;t2;DURATION;P3D;;true;NONE;;;;;
Thursday;APW20000405.0276;t3;DATE;2000-04-06;;false;NONE;;;;;
4 in the morning;APW20000405.0276;t4;TIME;2000-04-06T04:00;;false;NONE;;;;;
4 a.m. EDT Thursday;APW20000405.0276;t5;DATE;2000-04-06T04:00;;false;NONE;;;;;
Wednesday;APW20000405.0276;t6;DATE;2000-04-05;;false;NONE;;;;;
this week;APW20000405.0276;t7;DATE;2000-W14;;false;NONE;;;;;
late November;APW20000405.0276;t9;DATE;1999-11;END;false;NONE;;;;;
Wednesday night;APW20000405.0276;t10;DATE;2000-04-05;;false;NONE;;;;;
the past four months;APW20000405.0276;t12;DURATION;P4M;;true;NONE;;t1;;;
2000-04-17;APW20000417.0031;t0;TIME;2000-04-17;;false;CREATION_TIME;;;;;
today;APW20000417.0031;t1;DATE;2000-04-17;;false;NONE;;;;;
five months;APW20000417.0031;t2;DURATION;P5M;;true;NONE;t4;;;;
Sunday night;APW20000417.0031;t3;DATE;2000-04-16;;false;NONE;;;;;
November;APW20000417.0031;t4;DATE;1999-11;;false;NONE;;;;;
Thursday;APW20000417.0031;t5;DATE;2000-04-13;;false;NONE;;;;;
Sunday night;APW20000417.0031;t6;DATE;2000-04-16;;false;NONE;;;;;
April 6;APW20000417.0031;t7;DATE;2000-04-06;;false;NONE;;;;;
Sunday;APW20000417.0031;t8;DATE;2000-04-16;;false;NONE;;;;;
today;APW20000417.0031;t9;DATE;2000-04-17;;false;NONE;;;;;
1962;APW20000417.0031;t10;DATE;1962;;false;NONE;;;;;
Sunday;APW20000417.0031;t11;DATE;2000-04-16;;false;NONE;;;;;
Easter week;APW20000417.0031;t12;DATE;2000-W16;;false;NONE;;;;;
1998-09-07;NYT19980907.0112;t0;TIME;1998-09-07;;false;CREATION_TIME;;;;;
years-old;NYT19980907.0112;t11;DURATION;P1Y;;true;NONE;;;;;
Aug. 7;NYT19980907.0112;t2;DATE;1998-08-07;;false;NONE;;;;;
Aug. 13;NYT19980907.0112;t3;DATE;1998-08-13;;false;NONE;;;;;
now;NYT19980907.0112;t4;DATE;PRESENT_REF;;true;NONE;;;;;
last year;NYT19980907.0112;t5;DATE;1997;;false;NONE;;;;;
1980;NYT19980907.0112;t6;DATE;1980;;false;NONE;;;;;
last year;NYT19980907.0112;t7;DATE;1997;;false;NONE;;;;;
now;NYT19980907.0112;t8;DATE;PRESENT_REF;;true;NONE;;;;;
13 years;NYT19980907.0112;t9;DURATION;P12Y;;true;NONE;;;;;
now;NYT19980907.0112;t10;DATE;PRESENT_REF;;true;NONE;;;;;
1998-10-25 21:00;NYT19981025.0188;t0;TIME;1998-10-25T21:00;;false;CREATION_TIME;;;;;
Monday, Oct. 26;NYT19981025.0188;t2;DATE;1998-10-26;;true;NONE;;;;;
past decade;NYT19981025.0188;t3;DURATION;P10Y;;true;NONE;;t0;;;
Friday;NYT19981025.0188;t4;DATE;1998-10-23;;true;NONE;;;;;
Last week;NYT19981025.0188;t5;DATE;1998-10;;true;NONE;;;;;
1994;NYT19981025.0188;t6;DATE;1994;;false;NONE;;;;;
January;NYT19981025.0188;t7;DATE;1998-01;;true;NONE;;;;;
week;NYT19981025.0188;t8;DATE;1998-01;;true;NONE;;;;;
1993;NYT19981025.0188;t9;DATE;1993;;false;NONE;;;;;
last five years;NYT19981025.0188;t10;DURATION;P5Y;;true;NONE;;t0;;;
1982;NYT19981025.0188;t11;DATE;1982;;false;NONE;;;;;
1992;NYT19981025.0188;t12;DATE;1992;;false;NONE;;;;;
1998-10-25 21:57;NYT19981025.0216;t0;TIME;1998-10-25T21:57;;false;CREATION_TIME;;;;;
Sunday;NYT19981025.0216;t2;DATE;1998-10-25;;true;NONE;;;;;
over an hour;NYT19981025.0216;t3;DURATION;PT1H;;false;NONE;;;;;
Sunday;NYT19981025.0216;t4;DATE;1998-10-25;;true;NONE;;;;;
1992;NYT19981025.0216;t5;DATE;1992-05-10;;false;NONE;;;;;
1980s;NYT19981025.0216;t7;DATE;198X;END;false;NONE;;;;;
1990s;NYT19981025.0216;t8;DATE;199X;START;false;NONE;;;;;
1992;NYT19981025.0216;t9;DATE;1992-10-02;;false;NONE;;;;;
1998-10-26 22:54;NYT19981026.0446;t0;TIME;1998-10-26T22:54;;false;CREATION_TIME;;;;;
Friday;NYT19981026.0446;t2;DATE;1998-10-23;;true;NONE;;;;;
Saturday;NYT19981026.0446;t3;DATE;1998-10-24;;true;NONE;;;;;
Saturday;NYT19981026.0446;t4;DATE;1998-10-24;;true;NONE;;;;;
Tuesday;NYT19981026.0446;t5;DATE;1998-10-27;;true;NONE;;;;;
last week;NYT19981026.0446;t6;DATE;1998-10-XX;;true;NONE;;;;;
earlier this year;NYT19981026.0446;t7;DATE;1998-XX-XX;;true;NONE;;;;;
1994;NYT19981026.0446;t8;DATE;1994;;false;NONE;;;;;
Election Day;NYT19981026.0446;t9;DATE;1998-11-03;;true;NONE;;;;;
Sunday;NYT19981026.0446;t10;DATE;1998-10-25;;true;NONE;;;;;
1992;NYT19981026.0446;t11;DATE;1992;;false;NONE;;;;;
Monday;NYT19981026.0446;t12;DATE;1998-10-26;;false;NONE;;;;;
first day;NYT19981026.0446;t13;DATE;1999-01-XX;;true;NONE;;;;;
next week;NYT19981026.0446;t14;DATE;1998-11-03;;true;NONE;;;;;
1998-11-20 19:30;NYT19981120.0362;t0;TIME;1998-11-20T19:30;;false;CREATION_TIME;;;;;
last month;NYT19981120.0362;t2;DATE;1998-10;;true;NONE;;;;;
days;NYT19981120.0362;t7;DATE;1998-10-XX;;true;NONE;;;;;
Friday;NYT19981120.0362;t3;DATE;1998-11-20;;true;NONE;;;;;
Oct. 23;NYT19981120.0362;t4;DATE;1998-10-23;;true;NONE;;;;;
Friday;NYT19981120.0362;t5;DATE;1998-11-20;;true;NONE;;;;;
four years;NYT19981120.0362;t6;DURATION;P4Y;;false;NONE;;t0;;;
1998-11-21 17:17;NYT19981121.0173;t0;TIME;1998-11-21T17:17;;false;CREATION_TIME;;;;;
last week;NYT19981121.0173;t2;DATE;1998-11;;true;NONE;;;;;
Thursday;NYT19981121.0173;t3;DATE;1998-11-19;;true;NONE;;;;;
Saturday;NYT19981121.0173;t4;DATE;1998-11-21;;true;NONE;;;;;
Oct. 23;NYT19981121.0173;t5;DATE;1998-10-23;;true;NONE;;;;;
day;NYT19981121.0173;t6;SET;P1D;;false;NONE;;;a;100X;
daily;NYT19981121.0173;t7;SET;P1D;;false;NONE;;;;1X;
Friday;NYT19981121.0173;t8;DATE;1998-11-20;;true;NONE;;;;;
Saturday;NYT19981121.0173;t9;DATE;1998-11-21;;true;NONE;;;;;
Friday, Oct. 23;NYT19981121.0173;t10;DATE;1998-10-23;;true;NONE;;;;;
day;NYT19981121.0173;t11;DATE;1998-10-24;;true;NONE;;;;;
1999-03-12 18:41;NYT19990312.0271;t0;TIME;1999-03-12T18:41;;false;CREATION_TIME;;;;;
Friday;NYT19990312.0271;t3;DATE;1999-03-12;;true;NONE;;;;;
1948;NYT19990312.0271;t4;DATE;1948-XX;;false;NONE;;;;;
six year;NYT19990312.0271;t5;DURATION;P6Y;;false;NONE;;;;;
10 years ago;NYT19990312.0271;t6;DATE;1989-XX;;true;NONE;;;;;
Friday;NYT19990312.0271;t7;DATE;1999-03-12;;true;NONE;;;;;
next month;NYT19990312.0271;t8;DATE;1999-04;;true;NONE;;;;;
coming years;NYT19990312.0271;t9;DURATION;PXY;;true;NONE;;;;;
1989;NYT19990312.0271;t10;DATE;1989;;false;NONE;;;;;
today;NYT19990312.0271;t11;DATE;1999-03-12;;true;NONE;;;;;
1968;NYT19990312.0271;t12;DATE;1968;;false;NONE;;;;;
1989;NYT19990312.0271;t13;DATE;1989;;false;NONE;;;;;
1956;NYT19990312.0271;t14;DATE;1956;;false;NONE;;;;;
Friday's;NYT19990312.0271;t15;DATE;1999-03-12;;true;NONE;;;;;
April 4, 1949;NYT19990312.0271;t16;DATE;1949-04-04;;false;NONE;;;;;
1952;NYT19990312.0271;t17;DATE;1952;;false;NONE;;;;;
1955;NYT19990312.0271;t18;DATE;1955;;false;NONE;;;;;
1982;NYT19990312.0271;t19;DATE;1982;;false;NONE;;;;;
1993;NYT19990312.0271;t20;DATE;1993;;false;NONE;;;;;
Friday;NYT19990312.0271;t25;DATE;1999-03-12;;true;NONE;;;;;
July 1997;NYT19990312.0271;t21;DATE;1997-07;;false;NONE;;;;;
1997;NYT19990312.0271;t22;DATE;1997;;false;NONE;;;;;
last year;NYT19990312.0271;t23;DATE;1998;;true;NONE;;;;;
Friday;NYT19990312.0271;t24;DATE;1999-03-12;;true;NONE;;;;;
1999-04-19 23:14;NYT19990419.0515;t0;TIME;1999-04-19T23:14;;false;CREATION_TIME;;;;;
11 days ago;NYT19990419.0515;t2;DATE;1999-04-08;;true;NONE;;;;;
October;NYT19990419.0515;t3;DATE;1998-10;;true;NONE;;;;;
next week.;NYT19990419.0515;t4;DATE;1999-04-XX;;true;NONE;t0;;;;
Oct. 23;NYT19990419.0515;t5;DATE;1998-10-23;;true;NONE;;;;;
Monday;NYT19990419.0515;t6;DATE;1999-04-19;;true;NONE;;;;;
years;NYT19990419.0515;t7;DURATION;PXY;;true;NONE;;t0;;;
April 8;NYT19990419.0515;t8;DATE;1999-04-08;;true;NONE;;;;;
6 a.m. ten days;NYT19990419.0515;t9;TIME;1998-10-13T06:00;;true;NONE;;;;;
days;NYT19990419.0515;t16;DATE;199X-XX-XX;;true;NONE;t14;t12;;;
1994;NYT19990419.0515;t14;DATE;1994-XX-XX;;true;NONE;;;;;
1995;NYT19990419.0515;t11;DATE;1995-XX-XX;;true;NONE;;;;;
1997;NYT19990419.0515;t12;DATE;1997-XX-XX;;true;NONE;;;;;
10 p.m;NYT19990419.0515;t15;TIME;1998-10-23T22:00;;true;NONE;;;;;
1999-05-05 21:01;NYT19990505.0443;t0;TIME;1999-05-05T21:01;;false;CREATION_TIME;;;;;
Wednesday;NYT19990505.0443;t2;DATE;1999-05-05;;true;NONE;;;;;
October;NYT19990505.0443;t3;DATE;1998-10;;true;NONE;;;;;
April;NYT19990505.0443;t4;DATE;1999-04;;true;NONE;;;;;
Thursday;NYT19990505.0443;t5;DATE;1999-05-06;;true;NONE;;;;;
Oct. 23;NYT19990505.0443;t6;DATE;1998-10-23;;true;NONE;;;;;
April 8;NYT19990505.0443;t7;DATE;1999-04-08;;true;NONE;;;;;
days;NYT19990505.0443;t8;DATE;1998-10;;true;NONE;;;;;
two weeks;NYT19990505.0443;t9;DURATION;P2W;;true;NONE;t6;;;;
6 a.m;NYT19990505.0443;t10;TIME;1998-10-13T06:00;;false;NONE;;;;;
10 days;NYT19990505.0443;t11;DATE;1998-10-13;;true;NONE;;;;;
2000-01-05;NYT20000105.0325;t0;TIME;2000-01-05;;false;CREATION_TIME;;;;;
Wednesday;NYT20000105.0325;t1;DATE;2000-01-05;;false;NONE;;;;;
Jan. 14;NYT20000105.0325;t2;DATE;2000-01-14;;false;NONE;;;;;
Wednesday;NYT20000105.0325;t3;DATE;2000-01-05;;false;NONE;;;;;
Today;NYT20000105.0325;t4;DATE;2000-01-05;;false;NONE;;;;;
two days;NYT20000105.0325;t5;DURATION;P2D;;true;NONE;;;;;
Jan. 14;NYT20000105.0325;t6;DATE;2000-01-14;;false;NONE;;;;;
Wednesday;NYT20000105.0325;t7;DATE;2000-01-05;;false;NONE;;;;;
2000-01-06;NYT20000106.0007;t0;TIME;2000-01-06;;false;CREATION_TIME;;;;;
Thursday;NYT20000106.0007;t9;DATE;2000-01-06;;true;NONE;;;;;t1
Jan. 6;NYT20000106.0007;t1;DATE;2000-01-06;;false;NONE;;;;;
Wednesday;NYT20000106.0007;t3;DATE;2000-01-05;;false;NONE;;;;;
Jan. 14;NYT20000106.0007;t4;DATE;2000-01-14;;false;NONE;;;;;
six weeks ago;NYT20000106.0007;t5;DATE;1999-W47;;false;NONE;;;;;
two days;NYT20000106.0007;t6;DURATION;P2D;;true;NONE;;;;;
Thanksgiving Day;NYT20000106.0007;t7;DATE;1999-11-25;;false;NONE;;;;;
Wednesday;NYT20000106.0007;t8;DATE;2000-01-05;;false;NONE;;;;;
2000-01-13;NYT20000113.0267;t0;TIME;2000-01-13;;false;CREATION_TIME;;;;;
last November;NYT20000113.0267;t1;DATE;1999-11;;false;NONE;;;;;
Jan. 24;NYT20000113.0267;t2;DATE;2000-01-24;;false;NONE;;;;;
2000-02-24;NYT20000224.0173;t0;DATE;2000-02-24;;false;CREATION_TIME;;;;;
the week of March 6;NYT20000224.0173;t2;DATE;2000-W10;;false;NONE;;;;;
this week;NYT20000224.0173;t3;DATE;2000-W8;;false;NONE;;;;;
1966;NYT20000224.0173;t4;DATE;1966;;false;NONE;;;;;
1960s;NYT20000224.0173;t5;DATE;196X;;false;NONE;;;;;
1979;NYT20000224.0173;t6;DATE;1979;;false;NONE;;;;;
1983;NYT20000224.0173;t7;DATE;1983;;false;NONE;;;;;
1984;NYT20000224.0173;t8;DATE;1984;;false;NONE;;;;;
now;NYT20000224.0173;t9;DATE;PRESENT_REF;;true;NONE;;;;;t0
post-1959;NYT20000224.0173;t14;DATE;1959;AFTER;true;NONE;;;;;
years;NYT20000224.0173;t15;DURATION;PXY;;false;NONE;;;;;
early 1990s;NYT20000224.0173;t10;DATE;199X;;false;NONE;;;;;
a year;NYT20000224.0173;t11;DURATION;P1Y;;true;NONE;;;;;
1990;NYT20000224.0173;t12;DATE;1990;;false;NONE;;;;;
day before last Tuesday;NYT20000224.0173;t13;DATE;2000-02-21;;false;NONE;;;;;
the next morning;NYT20000224.0173;t16;DATE;2000-02-23;;false;NONE;;;;;
2000-03-29;NYT20000329.0359;t0;TIME;2000-03-29;;false;CREATION_TIME;;;;;
Wednesday;NYT20000329.0359;t1;DATE;2000-03-29;;false;NONE;;;;;
Wednesday evening;NYT20000329.0359;t2;DATE;2000-03-29TEV;;false;NONE;;;;;
May;NYT20000329.0359;t3;DATE;2000-05;;false;NONE;;;;;
Thursday morning;NYT20000329.0359;t4;DATE;2000-03-30;;false;NONE;;;;;
2000-03-30;NYT20000330.0406;t0;TIME;2000-03-30;;false;CREATION_TIME;;;;;
Tuesday morning;NYT20000330.0406;t1;DATE;2000-04-04;;false;NONE;;;;;
Wednesday;NYT20000330.0406;t3;DATE;2000-03-29;;false;NONE;;;;;
Thursday;NYT20000330.0406;t4;DATE;2000-03-30;;false;NONE;;;;;
current;NYT20000330.0406;t5;DATE;PRESENT_REF;;true;NONE;;;;;t4
Thursday;NYT20000330.0406;t6;DATE;2000-03-30;;false;NONE;;;;;
1984;NYT20000330.0406;t7;DATE;1984;;false;NONE;;;;;
2000-04-03;NYT20000403.0463;t0;TIME;2000-04-03;;false;CREATION_TIME;;;;;
Monday;NYT20000403.0463;t1;DATE;2000-04-03;;;NONE;;;;;
Tuesday;NYT20000403.0463;t2;DATE;2000-04-04;;;NONE;;;;;
Monday;NYT20000403.0463;t3;DATE;2000-04-03;;;NONE;;;;;
Tuesday;NYT20000403.0463;t4;DATE;2000-04-04;;;NONE;;;;;
Monday;NYT20000403.0463;t5;DATE;2000-04-03;;false;NONE;;;;;
day-long;NYT20000403.0463;t17;DURATION;P1D;;true;NONE;;;;;
tomorrow;NYT20000403.0463;t6;DATE;2000-04-04;;false;NONE;;;;;
four-month;NYT20000403.0463;t18;DURATION;P4M;ON_OR_BEFORE;false;NONE;;;;;t2
Thanksgiving Day;NYT20000403.0463;t7;DATE;1999-11-25;;false;NONE;;;;;
January;NYT20000403.0463;t8;DATE;2000-01;;false;NONE;;;;;
March;NYT20000403.0463;t9;DATE;2000-03;;false;NONE;;;;;
Last week;NYT20000403.0463;t10;DATE;2000-W13;;false;NONE;;;;;
two days;NYT20000403.0463;t11;DURATION;P2D;;true;NONE;;;;;
9 a.m. EST Tuesday;NYT20000403.0463;t20;DATE;2000-04-03T09:00;;false;NONE;;;;;
last Wednesday;NYT20000403.0463;t13;DATE;2000-03-29;;false;NONE;;;;;
the weekend;NYT20000403.0463;t21;DURATION;P2D;;false;NONE;;;;;
Monday;NYT20000403.0463;t15;DATE;2000-04-03;;false;NONE;;;;;
2000-04-06;NYT20000406.0002;t0;TIME;2000-04-06;;false;CREATION_TIME;;;;;
Thursday, April 6;NYT20000406.0002;t1;DATE;2000-04-06;;false;NONE;;;;;
Thursday;NYT20000406.0002;t2;DATE;2000-04-06;;false;NONE;;;;;
next month;NYT20000406.0002;t5;DATE;2000-05;;false;NONE;;;;;
daily;NYT20000406.0002;t6;DATE;P1D;;true;NONE;;;;1X;
now;NYT20000406.0002;t7;DATE;PRESENT_REF;;true;NONE;;;;;t1
2000-04-14;NYT20000414.0296;t0;TIME;2000-04-14;;false;CREATION_TIME;;;;;
Friday;NYT20000414.0296;t1;DATE;2000-04-14;;false;NONE;;;;;
five months;NYT20000414.0296;t2;DURATION;P5M;ON_OR_BEFORE;true;NONE;;;;;t1
now;NYT20000414.0296;t3;DATE;PRESENT_REF;;true;NONE;;;;;t1
1961;NYT20000414.0296;t4;DATE;1961;;false;NONE;;;;;
the last week;NYT20000414.0296;t5;DATE;2000-W15;;false;NONE;;;;;
at least 72 hours;NYT20000414.0296;t7;DURATION;PT72H;EQUAL_OR_MORE;true;NONE;;;;;
now;NYT20000414.0296;t8;DATE;PRESENT_REF;;true;NONE;;;;;t1
every day;NYT20000414.0296;t9;SET;P1D;;true;NONE;;;;1X;
every day;NYT20000414.0296;t10;SET;P1D;;true;NONE;;;;1X;
2000-04-24;NYT20000424.0319;t0;DATE;2000-04-24;;false;CREATION_TIME;;;;;
the weekend;NYT20000424.0319;t4;DATE;2000-04-22;;false;NONE;;;;;
last November;NYT20000424.0319;t2;DATE;1999-11;;false;NONE;;;;;
2000-06-01;NYT20000601.0442;t0;TIME;2000-06-01;;false;CREATION_TIME;;;;;
two more weeks;NYT20000601.0442;t13;DURATION;P2W;;true;NONE;;;;;
Thursday;NYT20000601.0442;t1;DATE;2000-06-01;;false;NONE;;;;;
Thursday;NYT20000601.0442;t2;DATE;2000-06-01;;false;NONE;;;;;
Thursday;NYT20000601.0442;t3;DATE;2000-06-01;;false;NONE;;;;;
14 days;NYT20000601.0442;t4;DURATION;P14D;;true;NONE;;;;;
six months;NYT20000601.0442;t5;DURATION;P6D;;true;NONE;;;;;
Thursday;NYT20000601.0442;t6;DATE;2000-06-01;;false;NONE;;;;;
last November;NYT20000601.0442;t7;DATE;1999-11;;false;NONE;;;;;
April 2;NYT20000601.0442;t8;DATE;2000-04-02;;false;NONE;;;;;
April 22;NYT20000601.0442;t9;DATE;2000-04-22;;false;NONE;;;;;
a month;NYT20000601.0442;t10;DURATION;P1M;;true;NONE;;;;;
14 days;NYT20000601.0442;t11;DURATION;P14D;;true;NONE;;;;;
seven-day;NYT20000601.0442;t15;DURATION;P7D;;true;NONE;;;;;
14-day;NYT20000601.0442;t16;DURATION;P14D;;true;NONE;;;;;
1961;NYT20000601.0442;t12;DATE;1961;;false;NONE;;;;;
1998-08-08;XIE19980808.0031;t0;TIME;1998-08-08;;false;CREATION_TIME;;;;;
August 7;XIE19980808.0031;t1;DATE;1998-08-07;;false;PUBLICATION_TIME;;;;;
Friday;XIE19980808.0031;t2;DATE;1998-08-07;;false;NONE;;;;;
Friday morning;XIE19980808.0031;t3;DATE;1998-08-07;;false;NONE;;;;;
1998-08-08;XIE19980808.0049;t0;TIME;1998-08-08;;false;CREATION_TIME;;;;;
August 8;XIE19980808.0049;t1;DATE;1998-08-08;;false;PUBLICATION_TIME;;;;;
Saturday;XIE19980808.0049;t2;DATE;1998-08-08;;false;NONE;;;;;
weekly;XIE19980808.0049;t3;SET;P1W;;true;NONE;;;;1X;
Friday;XIE19980808.0049;t4;DATE;1998-08-07;;false;NONE;;;;;
1998-08-08;XIE19980808.0060;t0;TIME;1998-08-08;;false;CREATION_TIME;;;;;
August 8;XIE19980808.0060;t1;DATE;1998-08-08;;false;PUBLICATION_TIME;;;;;
Saturday;XIE19980808.0060;t2;DATE;1998-08-08;;false;NONE;;;;;
Friday;XIE19980808.0060;t3;DATE;1998-08-07;;false;NONE;;;;;
Friday morning;XIE19980808.0060;t4;TIME;1998-08-07TMO;;false;NONE;;;;;
Friday;XIE19980808.0060;t5;DATE;1998-08-07;;false;NONE;;;;;
August 7;XIE19980808.0188;t0;DATE;1998-08-07;;false;CREATION_TIME;;;;;
August 7;XIE19980808.0188;t111;DATE;1998-08-07;;false;PUBLICATION_TIME;;;;;
Friday;XIE19980808.0188;t2;DATE;1998-08-07;;false;NONE;;;;;
Friday;XIE19980808.0188;t3;DATE;1998-08-07;;false;NONE;;;;;
August 8;XIE19980809.0010;t0;DATE;1998-08-08;;false;CREATION_TIME;;;;;
August 8;XIE19980809.0010;t111;DATE;1998-08-08;;false;PUBLICATION_TIME;;;;;
Saturday;XIE19980809.0010;t2;DATE;1998-08-08;;false;NONE;;;;;
Friday;XIE19980809.0010;t3;DATE;1998-08-07;;false;NONE;;;;;
August 11;XIE19980812.0062;t0;DATE;1998-08-11;;false;CREATION_TIME;;;;;
Tuesday;XIE19980812.0062;t2;DATE;1998-08-11;;false;NONE;;;;;
last Friday;XIE19980812.0062;t3;DATE;1998-08-07;;false;NONE;;;;;
recent days;XIE19980812.0062;t8;DURATION;PXD;;true;NONE;;;;;
Tuesday;XIE19980812.0062;t4;DATE;1998-08-11;;false;NONE;;;;;
Tuesday;XIE19980812.0062;t5;DATE;1998-08-11;;false;NONE;;;;;
Monday;XIE19980812.0062;t6;DATE;1998-08-10;;false;NONE;;;;;
August 13;XIE19980814.0294;t0;DATE;1998-08-14;;false;CREATION_TIME;;;;;
Thursday;XIE19980814.0294;t2;DATE;1998-08-13;;false;NONE;;;;;
Wednesday;XIE19980814.0294;t3;DATE;1998-08-12;;false;NONE;;;;;
1998-08-21;XIE19980821.0077;t0;TIME;1998-08-21;;false;CREATION_TIME;;;;;
August 21;XIE19980821.0077;t111;DATE;1998-08-21;;false;PUBLICATION_TIME;;;;;
Friday;XIE19980821.0077;t2;DATE;1998-08-21;;false;NONE;;;;;
August 7;XIE19980821.0077;t3;DATE;1998-08-07;;false;NONE;;;;;
now;XIE19980821.0077;t4;DATE;PRESENT_REF;;true;NONE;;;;;
Thursday;XIE19980821.0077;t5;DATE;1998-08-20;;false;NONE;;;;;
Thursday;XIE19980821.0077;t6;DATE;1998-08-20;;false;NONE;;;;;
Friday morning;XIE19980821.0077;t7;TIME;1998-08-21TMO;;false;NONE;;;;;
Thursday;XIE19980821.0077;t8;DATE;1998-08-20;;false;NONE;;;;;
Friday;XIE19980821.0077;t9;DATE;1998-08-21;;false;NONE;;;;;
three months;XIE19980821.0077;t10;DURATION;P3M;;true;NONE;;;;;
Friday;XIE19980821.0077;t11;DATE;1998-08-21;;false;NONE;;;;;
1998-12-03;XIE19981203.0008;t0;DATE;1998-12-03;;false;CREATION_TIME;;;;;
December 2;XIE19981203.0008;t111;DATE;1998-12-02;;false;;;;;;
Wednesday;XIE19981203.0008;t2;DATE;1998-12-02;;true;NONE;;;;;
October;XIE19981203.0008;t3;DATE;1998-10;;true;NONE;;;;;
February;XIE19981203.0008;t4;DATE;1998-02;;true;NONE;;;;;
last year;XIE19981203.0008;t5;DATE;1997;;true;NONE;;;;;
April;XIE19981203.0008;t6;DATE;1999-04;;true;NONE;;;;;
1999-02-10;XIE19990210.0079;t0;DATE;1999-02-10;;false;CREATION_TIME;;;;;
February 10;XIE19990210.0079;t111;DATE;1999-02-10;;false;;;;;;
March;XIE19990210.0079;t2;DATE;1999-03;;true;NONE;;;;;
Wednesday;XIE19990210.0079;t3;DATE;1999-02-09;;true;NONE;;;;;
March;XIE19990210.0079;t4;DATE;1999-03;;true;NONE;;;;;
April 24;XIE19990210.0079;t5;DATE;1999-04-24;;true;NONE;;;;;
25;XIE19990210.0079;t6;DATE;1999-04-25;;true;NONE;;;;;
March;XIE19990210.0079;t7;DATE;1999-03;;true;NONE;;;;;
July 1997;XIE19990210.0079;t8;DATE;1997-07;;false;NONE;;;;;
Tuesday;XIE19990210.0079;t9;DATE;1999-02-08;;true;NONE;;;;;
1999-02-27;XIE19990227.0171;t0;DATE;1999-02-27;;false;CREATION_TIME;;;;;
February 26;XIE19990227.0171;t111;DATE;1999-02-26;;false;;;;;;
July 1997;XIE19990227.0171;t2;DATE;1997-07;;false;NONE;;;;;
March 12;XIE19990227.0171;t3;DATE;1999-03-12;;true;NONE;;;;;
February 10;XIE19990227.0171;t4;DATE;1999-02-10;;true;NONE;;;;;
March 12;XIE19990227.0171;t5;DATE;1999-03-12;;true;NONE;;;;;
1999-03-13;XIE19990313.0031;t0;DATE;1999-03-13;;false;CREATION_TIME;;;;;
March 12;XIE19990313.0031;t111;DATE;1999-03-12;;false;;;;;;
Friday;XIE19990313.0031;t2;DATE;1999-03-12;;true;NONE;;;;;
day;XIE19990313.0031;t3;DATE;1999-03-12;;true;NONE;;;;;
1999-03-13;XIE19990313.0173;t0;DATE;1999-03-13;;false;CREATION_TIME;;;;;
March 12;XIE19990313.0173;t111;DATE;1999-03-12;;false;;;;;;
Friday;XIE19990313.0173;t2;DATE;1999-03-12;;true;NONE;;;;;
Friday;XIE19990313.0173;t3;DATE;1999-03-12;;true;NONE;;;;;
Friday;XIE19990313.0173;t4;DATE;1999-03-12;;true;NONE;;;;;
Friday;XIE19990313.0173;t5;DATE;1999-03-12;;true;NONE;;;;;
Friday;XIE19990313.0173;t6;DATE;1999-03-12;;true;NONE;;;;;
1999-03-13;XIE19990313.0229;t0;DATE;1999-03-13;;false;CREATION_TIME;;;;;
Friday;XIE19990313.0229;t2;DATE;1999-03-12;;true;NONE;;;;;
day;XIE19990313.0229;t3;DATE;1999-03-12;;true;NONE;;;;;
this century,;XIE19990313.0229;t4;DURATION;P100Y;;true;NONE;;;;;
19980108;ABC19980108.1830.0711;t0;DATE;1998-01-08;;false;CREATION_TIME;;;;;
week;ABC19980108.1830.0711;t83;DURATION;P1W;;false;NONE;;;;;
the last twenty four hours;ABC19980108.1830.0711;t85;DURATION;P1D;;true;NONE;;;;;t0
five year;ABC19980108.1830.0711;t86;DURATION;P5Y;;false;NONE;;;;;
four year;ABC19980108.1830.0711;t87;DURATION;P4Y;;false;NONE;;;;;
Now;ABC19980108.1830.0711;t196;DATE;PRESENT_REF;;true;NONE;;;;;t0
October;ABC19980108.1830.0711;t89;DATE;1997-10;;true;NONE;;;;;t0
now;ABC19980108.1830.0711;t90;DATE;PRESENT_REF;;true;NONE;;;;;t0
the past three months;ABC19980108.1830.0711;t98;DURATION;P3M;;true;NONE;;;;;t0
ten years;ABC19980108.1830.0711;t99;DURATION;P10Y;;false;NONE;;;;;
a couple of years;ABC19980108.1830.0711;t100;DURATION;P2Y;APPROX;false;NONE;;;;;
19980114;ABC19980114.1830.0611;t0;DATE;1998-01-14;;false;CREATION_TIME;;;;;
today;ABC19980114.1830.0611;t53;DATE;1998-01-14;;true;NONE;;;;;t0
a minute and a half;ABC19980114.1830.0611;t58;DURATION;PT1M30S;;false;NONE;;;;;
19980120;ABC19980120.1830.0957;t0;DATE;1998-01-20;;false;CREATION_TIME;;;;;
nearly forty years;ABC19980120.1830.0957;t94;DURATION;P40Y;EQUAL_OR_LESS;false;NONE;;;;;
this evening;ABC19980120.1830.0957;t1000;TIME;1998-01-20TEV;;;;;;;;
19980304;ABC19980304.1830.1636;t0;DATE;1998-03-04;;false;CREATION_TIME;;;;;
today;ABC19980304.1830.1636;t32;DATE;1998-03-04;;true;NONE;;;;;t0
December;ABC19980304.1830.1636;t33;DATE;1998-12;;true;NONE;;;;;t0
twenty years;ABC19980304.1830.1636;t34;DURATION;P20Y;;false;NONE;;;;;
now;ABC19980304.1830.1636;t55;DATE;PRESENT_REF;;true;NONE;;;;;t0
now;ABC19980304.1830.1636;t36;DATE;PRESENT_REF;;true;NONE;;;;;t0
08-15-90 1337EDT;AP900815-0044;t0;TIME;1990-08-15T13:37;;false;CREATION_TIME;;;;;
today;AP900815-0044;t4;DATE;1990-08-15;;true;NONE;;;;;t0
today;AP900815-0044;t14;DATE;1990-08-15;;true;NONE;;;;;t0
Tuesday;AP900815-0044;t22;DATE;1990-08-14;;true;NONE;;;;;t0
today;AP900815-0044;t380;DATE;1990-08-15;;true;NONE;;;;;t0
today;AP900815-0044;t37;DATE;1990-08-15;;true;NONE;;;;;t0
some time;AP900815-0044;t47;DURATION;PXM;;false;NONE;;;;;
now;AP900815-0044;t56;DATE;PRESENT_REF;;true;NONE;;;;;t0
Friday;AP900815-0044;t65;DATE;1990-08-10;;true;NONE;;;;;t0
August 1988;AP900815-0044;t79;DATE;1988-08;;false;NONE;;;;;
eight-year;AP900815-0044;t82;DURATION;P8Y;;false;NONE;;;;;
Aug. 2;AP900815-0044;t89;DATE;1990-08-02;;true;NONE;;;;;t0
up to 180 days;AP900815-0044;t719;DURATION;P180D;EQUAL_OR_LESS;false;NONE;;;;;
Tuesday;AP900815-0044;t114;DATE;1990-08-14;;true;NONE;;;;;t0
today;AP900815-0044;t120;DATE;1990-08-15;;true;NONE;;;;;t0
today;AP900815-0044;t140;DATE;1990-08-15;;true;NONE;;;;;t0
today;AP900815-0044;t151;DATE;1990-08-15;;true;NONE;;;;;t0
Tuesday;AP900815-0044;t162;DATE;1990-08-14;;true;NONE;;;;;t0
now;AP900815-0044;t170;DATE;PRESENT_REF;;true;NONE;;;;;t0
Aug. 6;AP900815-0044;t176;DATE;1990-08-06;;true;NONE;;;;;t0
Tuesday;AP900815-0044;t188;DATE;1990-08-07;;true;NONE;;;;;t0
today;AP900815-0044;t194;DATE;1990-08-15;;true;NONE;;;;;t0
Tuesday;AP900815-0044;t204;DATE;1990-08-07;;true;NONE;;;;;t0
Monday;AP900815-0044;t210;DATE;1990-08-06;;true;NONE;;;;;
Thursday;AP900815-0044;t213;DATE;1990-08-09;;true;NONE;;;;;t0
today;AP900815-0044;t215;DATE;1990-08-15;;true;NONE;;;;;t0
this crucial moment;AP900815-0044;t1192;DATE;PRESENT_REF;;true;NONE;;;;;t215
Tuesday;AP900815-0044;t252;DATE;1990-08-07;;true;NONE;;;;;t0
Tuesday;AP900815-0044;t269;DATE;1990-08-07;;true;NONE;;;;;t0
now;AP900815-0044;t271;DATE;PRESENT_REF;;true;NONE;;;;;t0
today;AP900815-0044;t275;DATE;1990-08-15;;true;NONE;;;;;t0
eighth day;AP900815-0044;t276;DATE;1990-08-15;;true;NONE;;;;;t275
now;AP900815-0044;t282;DATE;PRESENT_REF;;true;NONE;;;;;t0
weeks;AP900815-0044;t1460;DURATION;PXW;;false;NONE;;;;;
08-16-90 2041EDT;AP900816-0139;t0;TIME;1990-08-16T20:41;;false;CREATION_TIME;;;;;
Thursday;AP900816-0139;t288;DATE;1990-08-16;;true;NONE;;;;;t0
two-week;AP900816-0139;t289;DURATION;P2W;;false;NONE;;;;;
two-hour;AP900816-0139;t290;DURATION;PT2H;;false;NONE;;;;;
Thursday;AP900816-0139;t291;DATE;1990-08-16;;true;NONE;;;;;t0
now;AP900816-0139;t316;DATE;PRESENT_REF;;true;NONE;;;;;t0
Aug. 2;AP900816-0139;t292;DATE;1990-08-02;;true;NONE;;;;;t0
Thursday;AP900816-0139;t293;DATE;1990-08-16;;true;NONE;;;;;t0
a fairly lengthy period;AP900816-0139;t339;DURATION;PXX;;false;NONE;;;;;
now;AP900816-0139;t295;DATE;PRESENT_REF;;true;NONE;;;;;t0
now;AP900816-0139;t299;DATE;PRESENT_REF;;true;NONE;;;;;t0
A day earlier;AP900816-0139;t352;DURATION;P1D;;false;NONE;;;;;
this week;AP900816-0139;t300;DATE;1990-W33;;true;NONE;;;;;t0
Wednesday;AP900816-0139;t301;DATE;1990-08-15;;true;NONE;;;;;t0
Thursday;AP900816-0139;t302;DATE;1990-08-16;;true;NONE;;;;;t0
September;AP900816-0139;t303;DATE;1990-09;;true;NONE;;;;;t0
Thursday;AP900816-0139;t304;DATE;1990-08-16;;true;NONE;;;;;t0
02/13/1998 14:26:00;APW19980213.1310;t0;TIME;1998-02-13T14:26:00;;false;CREATION_TIME;;;;;
210 years;APW19980213.1310;t110;DURATION;P210Y;;false;NONE;;;;;
Friday;APW19980213.1310;t111;DATE;1998-02-13;;true;NONE;;;;;t0
next year;APW19980213.1310;t112;DATE;1999;;true;NONE;;;;;t0
Friday;APW19980213.1310;t114;DATE;1998-02-13;;true;NONE;;;;;t0
2000;APW19980213.1310;t121;DATE;2000;;false;NONE;;;;;
several years ago;APW19980213.1310;t117;DATE;PAST_REF;;true;NONE;;;;;t0
this year;APW19980213.1310;t358;DATE;1998;;true;NONE;;;;;t0
1901;APW19980213.1310;t118;DATE;1901;;false;NONE;;;;;
20th century;APW19980213.1310;t1000;DATE;19;;;;;;;;
almost a hundred years;APW19980213.1310;t119;DURATION;P100Y;LESS_THAN;false;NONE;;;;;
1996;APW19980213.1310;t120;DATE;1996;;false;NONE;;;;;
02/13/1998 14:35:00;APW19980213.1320;t0;TIME;1998-02-13T14:35:00;;false;CREATION_TIME;;;;;
August;APW19980213.1320;t43;DATE;1998-08;;true;NONE;;;;;t0
a month;APW19980213.1320;t44;DURATION;P1M;;false;NONE;;;;;
current;APW19980213.1320;t46;DATE;PRESENT_REF;;true;NONE;;;;;t0
Friday;APW19980213.1320;t47;DATE;1998-02-13;;true;NONE;;;;;t0
Monday;APW19980213.1320;t190;SET;XXXX-WXX-1TNI;;true;NONE;;;;7D;t189
Tuesday nights;APW19980213.1320;t189;SET;XXXX-WXX-2TNI;;false;NONE;;;;7D;
March 30;APW19980213.1320;t56;DATE;1998-03-30;;true;NONE;;;;;t0
each Thursday;APW19980213.1320;t54;SET;XXXX-WXX-4;;false;NONE;;;each;1W;
August 6;APW19980213.1320;t55;DATE;1998-08-06;;true;NONE;;;;;t0
02/13/1998 15:44:00;APW19980213.1380;t0;TIME;1998-02-13T15:44:00;;false;CREATION_TIME;;;;;
Friday;APW19980213.1380;t33;DATE;1998-02-13;;true;NONE;;;;;t0
Friday;APW19980213.1380;t39;DATE;1998-02-13;;true;NONE;;;;;t0
10 p.m. Wednesday;APW19980213.1380;t35;TIME;1998-02-11T22:00;;true;NONE;;;;;t0
noon Thursday;APW19980213.1380;t36;TIME;1998-02-12T12:00;;true;NONE;;;;;t0
recent years;APW19980213.1380;t37;DURATION;PXY;;true;NONE;;;;;t0
02/19/1998 08:02:00;APW19980219.0476;t0;TIME;1998-02-19T08:02:00;;false;CREATION_TIME;;;;;
Thursday;APW19980219.0476;t2443;DATE;1998-02-19;;true;NONE;;;;;t0
almost two years ago;APW19980219.0476;t130;DURATION;P2Y;LESS_THAN;true;NONE;;t0;;;
the next two weeks;APW19980219.0476;t133;DURATION;P2W;;true;NONE;t0;;;;
March 1996;APW19980219.0476;t134;DATE;1996-03;;false;NONE;;;;;
11th century;APW19980219.0476;t1000;DATE;10;;;;;;;;
January this year;APW19980219.0476;t135;DATE;1998-01;;true;NONE;;;;;t0
weeks or months;APW19980219.0476;t137;DURATION;PXW;APPROX;true;NONE;t136;;;;
March 26, 1996;APW19980219.0476;t136;DATE;1996-03-26;;false;NONE;;;;;
22 months;APW19980219.0476;t138;DURATION;P22M;;true;NONE;t136;;;;
Thursday;APW19980219.0476;t2449;DATE;1998-02-19;;true;NONE;;;;;t0
last year;APW19980219.0476;t131;DATE;1997;;true;NONE;;;;;t0
now;APW19980219.0476;t2452;DATE;PRESENT_REF;;true;NONE;;;;;t0
a week;APW19980219.0476;t140;DURATION;P1W;;true;NONE;t136;;;;
the late 1970s;APW19980219.0476;t142;DATE;197;END;false;NONE;;;;;
mid-1996;APW19980219.0476;t143;DATE;1996;MID;false;NONE;;;;;
June last year;APW19980219.0476;t2228;DATE;1997-06;;true;NONE;;;;;t0
July last year;APW19980219.0476;t169;DATE;1997-06;;true;NONE;;;;;t0
02/27/1998 07:56:00;APW19980227.0468;t0;TIME;1998-02-27T07:56:00;;false;CREATION_TIME;;;;;
Friday;APW19980227.0468;t15;DATE;1998-02-27;;true;NONE;;;;;t0
February 1947;APW19980227.0468;t16;DATE;1947-02;;false;NONE;;;;;
02/27/1998 08:02:00;APW19980227.0476;t0;TIME;1998-02-27T08:02:00;;false;CREATION_TIME;;;;;
Friday;APW19980227.0476;t21;DATE;1998-02-27;;true;NONE;;;;;t0
1988;APW19980227.0476;t22;DATE;1988;;false;NONE;;;;;
1995;APW19980227.0476;t23;DATE;1995;;false;NONE;;;;;
1971;APW19980227.0476;t24;DATE;1971;;false;NONE;;;;;
02/27/1998 08:09:00;APW19980227.0487;t0;TIME;1998-02-27T08:09:00;;false;CREATION_TIME;;;;;
Friday;APW19980227.0487;t70;DATE;1998-02-27;;true;NONE;;;;;t0
more than four hours;APW19980227.0487;t71;DURATION;PT4H;MORE_THAN;false;NONE;;;;;
Friday;APW19980227.0487;t72;DATE;1998-02-27;;true;NONE;;;;;t0
November 1995;APW19980227.0487;t73;DATE;1995-11;;false;NONE;;;;;
02/27/1998 08:13:00;APW19980227.0489;t0;TIME;1998-02-27T08:13:00;;false;CREATION_TIME;;;;;
Friday;APW19980227.0489;t41;DATE;1998-02-27;;true;NONE;;;;;t0
nearly four years ago;APW19980227.0489;t42;DATE;1994;APPROX;true;NONE;;;;;t0
April 6, 1994;APW19980227.0489;t43;DATE;1994-04-06;;false;NONE;;;;;
2 1/2 years;APW19980227.0489;t44;DURATION;P2Y6M;;false;NONE;;;;;
a year;APW19980227.0489;t45;DURATION;P1Y;EQUAL_OR_LESS;false;NONE;;;;;
02/27/1998 08:17:00;APW19980227.0494;t0;TIME;1998-02-27T08:17:00;;false;CREATION_TIME;;;;;
Friday;APW19980227.0494;t2297;DATE;1998-02-27;;true;NONE;;;;;t0
centuries;APW19980227.0494;t154;DURATION;PXE;;false;NONE;;;;;
last May;APW19980227.0494;t143;DATE;1997-05;;true;NONE;;;;;t0
at least 20 more years;APW19980227.0494;t2300;DURATION;P20Y;EQUAL_OR_MORE;false;NONE;;;;;
Last year;APW19980227.0494;t146;DATE;1997;;true;NONE;;;;;t0
the past;APW19980227.0494;t149;DATE;PAST_REF;;true;NONE;;;;;t0
four-day;APW19980227.0494;t150;DURATION;P4D;;false;NONE;;;;;
10-year;APW19980227.0494;t500;DURATION;P10Y;;;;;;;;
last year;APW19980227.0494;t2303;DATE;1997;;true;NONE;;;;;t0
1996;APW19980227.0494;t152;DATE;1996;;false;NONE;;;;;
Friday;APW19980227.0494;t151;DATE;1998-02-27;;true;NONE;;;;;t0
03/01/1998 14:11:00;APW19980301.0720;t0;TIME;1998-03-01T14:11:00;;false;CREATION_TIME;;;;;
Sunday;APW19980301.0720;t123;DATE;1998-03-01;;true;NONE;;;;;t0
Sunday;APW19980301.0720;t125;DATE;1998-03-01;;true;NONE;;;;;t0
1978;APW19980301.0720;t128;DATE;1978;;false;NONE;;;;;
Friday;APW19980301.0720;t127;DATE;1998-02-27;;true;NONE;;;;;t0
Sunday;APW19980301.0720;t129;DATE;1998-03-01;;true;NONE;;;;;t0
today;APW19980301.0720;t134;DATE;1998-03-01;;true;NONE;;;;;t0
1985;APW19980301.0720;t1979;DATE;1985;;false;NONE;;;;;
Last week;APW19980301.0720;t1980;DATE;1998-W08;;true;NONE;;;;;t0
last year;APW19980301.0720;t1981;DURATION;1997;;true;NONE;;;;;t0
last February;APW19980301.0720;t1982;DATE;1997-02;;true;NONE;;;;;t0
Sunday;APW19980301.0720;t1983;DATE;1998-03-01;;true;NONE;;;;;t0
last week;APW19980301.0720;t1985;DATE;1998-W08;;true;NONE;;;;;t0
last week;APW19980301.0720;t1986;DATE;1998-W08;;true;NONE;;;;;t0
Sunday;APW19980301.0720;t1987;DATE;1998-03-01;;true;NONE;;;;;t0
nearly two years;APW19980301.0720;t1988;DURATION;P2Y;EQUAL_OR_LESS;false;NONE;;;;;
six weeks ago;APW19980301.0720;t1989;DATE;1998-W02;;true;NONE;;;;;t0
the time;APW19980301.0720;t1993;DATE;PAST_REF;;true;NONE;;;;;t1989
03/06/1998 13:19:00;APW19980306.1001;t0;TIME;1998-03-06T13:19:00;;false;CREATION_TIME;;;;;
Friday;APW19980306.1001;t138;DATE;1998-03-06;;true;NONE;;;;;t0
nearly two months;APW19980306.1001;t139;DURATION;P2M;APPROX;true;NONE;;t138;;;
10-hour;APW19980306.1001;t140;DURATION;PT10H;;false;NONE;;;;;
Previously;APW19980306.1001;t1191;DATE;PAST_REF;;true;NONE;;;;;t0
Thursday;APW19980306.1001;t141;DATE;1998-03-05;;true;NONE;;;;;t0
over a week;APW19980306.1001;t143;DURATION;P1W;MORE_THAN;false;NONE;;;;;
Jan. 13;APW19980306.1001;t1192;DATE;1998-01-13;;true;NONE;;;;;t0
daily;APW19980306.1001;t1000;SET;XXXX-XX-XX;;;;;;;;
Friday;APW19980306.1001;t144;DATE;1998-03-06;;true;NONE;;;;;t0
Feb. 23;APW19980306.1001;t1193;DATE;1998-02-23;;true;NONE;;;;;t0
Thursday;APW19980306.1001;t146;DATE;1998-03-05;;true;NONE;;;;;t0
Thursday;APW19980306.1001;t1194;DATE;1998-03-05;;true;NONE;;;;;t0
Friday;APW19980306.1001;t148;DATE;1998-03-06;;true;NONE;;;;;t0
next week;APW19980306.1001;t150;DATE;1998-W11;;true;NONE;;;;;t0
1990;APW19980306.1001;t151;DATE;1990;;false;NONE;;;;;
03/08/1998 06:26:00;APW19980308.0201;t0;TIME;1998-03-08T06:26:00;;true;CREATION_TIME;;;;;
Sunday;APW19980308.0201;t68;DATE;1998-03-08;;true;NONE;;;;;t0
recent days;APW19980308.0201;t71;DATE;PAST_REF;;true;NONE;;;;;t68
03/22/1998 14:57:00;APW19980322.0749;t0;TIME;1998-03-22T14:57:00;;false;CREATION_TIME;;;;;
Sunday;APW19980322.0749;t126;DATE;1998-03-22;;true;NONE;;;;;t0
8-month-old;APW19980322.0749;t127;DURATION;P8M;;false;NONE;;;;;
Monday;APW19980322.0749;t128;DATE;1998-03-23;;true;NONE;;;;;t0
Feb. 20;APW19980322.0749;t129;DATE;1998-02-20;;true;NONE;;;;;t0
Sunday;APW19980322.0749;t130;DATE;1998-03-22;;true;NONE;;;;;t0
May;APW19980322.0749;t131;DATE;1998-05;;true;NONE;;;;;t0
two weeks ago;APW19980322.0749;t2023;DATE;1998-03-08;;true;NONE;;;;;t0
10 days ago;APW19980322.0749;t132;DATE;1998-03-12;;true;NONE;;;;;t0
last week;APW19980322.0749;t134;DATE;1998-W12;;true;NONE;;;;;t0
February;APW19980322.0749;t135;DATE;1998-02;;true;NONE;;;;;t0
Sunday;APW19980322.0749;t136;DATE;1998-03-22;;true;NONE;;;;;t0
1972;APW19980322.0749;t137;DATE;1972;;false;NONE;;;;;
Sunday;APW19980322.0749;t138;DATE;1998-02-22;;true;NONE;;;;;t0
the past three summers;APW19980322.0749;t154;SET;XXXX-SU;;true;NONE;;;;3Y;t0
each July;APW19980322.0749;t150;SET;XXXX-07;;;;;;;;
this summer;APW19980322.0749;t144;DATE;1998-SU;;true;NONE;;;;;t0
this summer;APW19980322.0749;t145;DATE;1998-SU;;true;NONE;;;;;t0
Earlier Sunday;APW19980322.0749;t146;DATE;1998-03-22;START;true;NONE;;;;;t0
04/18/1998 06:07:00;APW19980418.0210;t0;TIME;1998-04-18T06:07:00;;false;CREATION_TIME;;;;;
Saturday;APW19980418.0210;t31;DATE;1998-04-18;;true;NONE;;;;;t0
May 26, 1980;APW19980418.0210;t33;DATE;1980-05-26;;false;NONE;;;;;
six days;APW19980418.0210;t34;DURATION;P6D;;true;NONE;t33;;;;
October 1984;APW19980418.0210;t35;DATE;1984-10;;false;NONE;;;;;
May 22, 1995;APW19980418.0210;t37;DATE;1995-05-22;;false;NONE;;;;;
the following year;APW19980418.0210;t38;DATE;1996;;true;NONE;;;;;t37
December;APW19980418.0210;t39;DATE;1997-12;;true;NONE;;;;;t0
05/01/1998 09:13:00;APW19980501.0480;t0;DATE;1998-05-01T09:13:00;;false;CREATION_TIME;;;;;
the future;APW19980501.0480;t153;DATE;FUTURE_REF;;true;NONE;;;;;t0
06/26/1998 07:07:00;APW19980626.0364;t0;TIME;1998-06-26T07:07:00;;false;CREATION_TIME;;;;;
Friday;APW19980626.0364;t40;DATE;1998-06-26;;true;NONE;;;;;t0
1995;APW19980626.0364;t41;DATE;1995;;false;NONE;;;;;
recently;APW19980626.0364;t42;DATE;PAST_REF;;true;NONE;;;;;t0
this September;APW19980626.0364;t43;DATE;1998-09;;true;NONE;;;;;t0
19980126;CNN19980126.1600.1104;t0;DATE;1998-01-26;;false;CREATION_TIME;;;;;
the fourth quarter;CNN19980126.1600.1104;t32;DURATION;1997-Q4;;true;NONE;;;;;t0
now;CNN19980126.1600.1104;t34;DATE;PRESENT_REF;;true;NONE;;;;;t0
today;CNN19980126.1600.1104;t33;DATE;1998-01-26;;true;NONE;;;;;t0
19980213;CNN19980213.2130.0155;t0;DATE;1998-02-13;;false;CREATION_TIME;;;;;
the future;CNN19980213.2130.0155;t105;DATE;FUTURE_REF;;true;NONE;;;;;t0
less than one hour;CNN19980213.2130.0155;t111;DURATION;PT1H;LESS_THAN;false;NONE;;;;;
Thursday;CNN19980213.2130.0155;t116;DATE;1998-02-12;;true;NONE;;;;;t0
today;CNN19980213.2130.0155;t119;DATE;1998-02-13;;true;NONE;;;;;t0
the day;CNN19980213.2130.0155;t126;DATE;1998-02-13;;true;NONE;;;;;t119
Friday;CNN19980213.2130.0155;t133;DATE;1998-02-13;;true;NONE;;;;;t0
now;CNN19980213.2130.0155;t135;DATE;PRESENT_REF;;true;NONE;;;;;t133
next week;CNN19980213.2130.0155;t145;DATE;1998-WXX;;true;NONE;;;;;t0
19980222;CNN19980222.1130.0084;t0;DATE;1998-02-22;;false;CREATION_TIME;;;;;
three hour;CNN19980222.1130.0084;t122;DURATION;PT3H;;false;NONE;;;;;
today;CNN19980222.1130.0084;t18;DATE;1998-02-22;;true;NONE;;;;;t0
later this afternoon;CNN19980222.1130.0084;t64;TIME;1998-02-22TAF;END;true;NONE;;;;;t0
no more than sixty days;CNN19980222.1130.0084;t70;DURATION;P60D;EQUAL_OR_LESS;false;NONE;;;;;
19980223;CNN19980223.1130.0960;t0;DATE;1998-02-23;;false;CREATION_TIME;;;;;
Now;CNN19980223.1130.0960;t21;DATE;PRESENT_REF;;true;NONE;;;;;t0
the middle of October;CNN19980223.1130.0960;t22;DATE;1997-10;MID;true;NONE;;;;;t0
today;CNN19980223.1130.0960;t23;DATE;1998-02-23;;true;NONE;;;;;t0
the winter of nineteen ninety-four;CNN19980223.1130.0960;t24;DATE;1994-WI;;false;NONE;;;;;
the last two weeks;CNN19980223.1130.0960;t25;DURATION;P2W;;true;NONE;;t0;;;
19980227;CNN19980227.2130.0067;t0;DATE;1998-02-27;;false;CREATION_TIME;;;;;
last month;CNN19980227.2130.0067;t93;DATE;1998-01;;true;NONE;;;;;t0
nineteen ninety-six;CNN19980227.2130.0067;t95;DATE;1996;;false;NONE;;;;;
January nineteen ninety-seven;CNN19980227.2130.0067;t96;DATE;1997-01;;false;NONE;;;;;
last month;CNN19980227.2130.0067;t97;DATE;1998-01;;true;NONE;;;;;t0
Now;CNN19980227.2130.0067;t178;DATE;PRESENT_REF;;true;NONE;;;;;t0
nineteen ninety-seven;CNN19980227.2130.0067;t107;DATE;1997;;false;NONE;;;;;
this week;CNN19980227.2130.0067;t108;DATE;1998-WXX;;true;NONE;;;;;t0
980120;ea980120.1830.0071;t0;DATE;1998-01-20;;false;CREATION_TIME;;;;;
this week;ea980120.1830.0071;t53;DATE;1998-W04;;true;NONE;;;;;t0
today;ea980120.1830.0071;t59;DATE;1998-01-20;;true;NONE;;;;;t0
now;ea980120.1830.0071;t56;DATE;PRESENT_REF;;true;NONE;;;;;t0
today;ea980120.1830.0071;t68;DATE;1998-01-20;;true;NONE;;;;;t0
Today;ea980120.1830.0071;t57;DATE;1998-01-20;;true;NONE;;;;;t0
now;ea980120.1830.0071;t58;DATE;PRESENT_REF;;true;NONE;;;;;t0
980120;ea980120.1830.0456;t0;DATE;1998-01-20;;false;CREATION_TIME;;;;;
today;ea980120.1830.0456;t14;DATE;1998-01-20;;true;NONE;;;;;t0
last night;ea980120.1830.0456;t15;TIME;1998-01-19TNI;;true;NONE;;;;;t0
now;ea980120.1830.0456;t16;DATE;PRESENT_REF;;true;NONE;;;;;t0
980111;ed980111.1130.0089;t0;DATE;1998-01-11;;false;CREATION_TIME;;;;;
the next several days;ed980111.1130.0089;t15;DURATION;PXD;;true;NONE;t0;;;;
Yesterday;ed980111.1130.0089;t16;DATE;1998-01-10;;true;NONE;;;;;t0
today;ed980111.1130.0089;t17;DATE;1998-01-11;;true;NONE;;;;;t0
today;ed980111.1130.0089;t18;DATE;1998-01-11;;true;NONE;;;;;t0
a while;ed980111.1130.0089;t20;DURATION;PXX;;true;NONE;;;;;t0
02/06/1998 22:19:00;NYT19980206.0460;t0;TIME;1998-02-06T22:19:00;;false;CREATION_TIME;;;;;
January;NYT19980206.0460;t191;DATE;1998-01;;true;NONE;;;;;t0
Friday;NYT19980206.0460;t193;DATE;1998-02-06;;true;NONE;;;;;t0
last month;NYT19980206.0460;t195;DATE;1998-01;;true;NONE;;;;;t0
last month;NYT19980206.0460;t196;DATE;1998-01;;true;NONE;;;;;t0
last month;NYT19980206.0460;t198;DATE;1998-01;;true;NONE;;;;;t0
hourly;NYT19980206.0460;t1001;SET;PT1H;;;;;;;;
a year earlier;NYT19980206.0460;t199;DATE;1997;;true;NONE;;;;;t0
the last decade;NYT19980206.0460;t200;DATE;198;;true;NONE;;;;;t0
coming months;NYT19980206.0460;t201;DATE;FUTURE_REF;;true;NONE;;;;;t0
Aug. 6;NYT19980206.0460;t202;DATE;1997-08-06;;true;NONE;;;;;t0
30-year;NYT19980206.0460;t500;DURATION;P30Y;;;;;;;;
January;NYT19980206.0460;t203;DATE;1998-01;;true;NONE;;;;;t0
last fall;NYT19980206.0460;t204;DATE;1997-FA;;true;NONE;;;;;t0
Friday;NYT19980206.0460;t205;DATE;1998-02-06;;true;NONE;;;;;t0
December;NYT19980206.0460;t206;DATE;1997-12;;true;NONE;;;;;t0
the last four months;NYT19980206.0460;t207;DURATION;P4M;;true;NONE;;t0;;;
the last three months;NYT19980206.0460;t208;DURATION;P3M;;true;NONE;;t0;;;
the first nine months;NYT19980206.0460;t212;DURATION;P9M;;true;NONE;t211;;;;
1997;NYT19980206.0460;t211;DATE;1997;;false;NONE;;;;;
the last few months;NYT19980206.0460;t213;DATE;PAST_REF;;true;NONE;;;;;t0
Friday;NYT19980206.0460;t2181;DATE;1998-02-06;;true;NONE;;;;;t0
January;NYT19980206.0460;t215;DATE;1998-01;;true;NONE;;;;;t0
last month;NYT19980206.0460;t218;DATE;1998-01;;true;NONE;;;;;t0
December;NYT19980206.0460;t219;DATE;1997-12;;true;NONE;;;;;t0
two decades;NYT19980206.0460;t1002;DURATION;P20Y;;;;;;;;
January;NYT19980206.0460;t222;DATE;1998-01;;true;NONE;;;;;t0
02/06/1998 22:29:00;NYT19980206.0466;t0;TIME;1998-02-06T22:29:00;;false;CREATION_TIME;;;;;
Friday;NYT19980206.0466;t30;DATE;1998-02-06;;true;NONE;;;;;t0
Thursday;NYT19980206.0466;t31;DATE;1998-02-05;;true;NONE;;;;;t0
Friday;NYT19980206.0466;t32;DATE;1998-02-06;;true;NONE;;;;;t0
Thursday;NYT19980206.0466;t33;DATE;1998-02-05;;true;NONE;;;;;t0
Thursday;NYT19980206.0466;t34;DATE;1998-02-05;;true;NONE;;;;;t0
the past few weeks;NYT19980206.0466;t35;DURATION;PXW;;true;NONE;;;;;t34
Friday;NYT19980206.0466;t37;DATE;1998-02-06;;true;NONE;;;;;t0
Friday;NYT19980206.0466;t38;DATE;1998-02-06;;true;NONE;;;;;t0
today;NYT19980206.0466;t39;DATE;1998-02-06;;true;NONE;;;;;t38
this morning;NYT19980206.0466;t40;TIME;1998-02-06TMO;;true;NONE;;;;;t38
02/12/1998 01:58:00;NYT19980212.0019;t0;TIME;1998-02-12T01:58:00;;false;CREATION_TIME;;;;;
Thursday evening;NYT19980212.0019;t44;TIME;1998-02-12TEV;;true;NONE;;;;;t0
around 7:15 p.m.;NYT19980212.0019;t46;TIME;1998-02-12T19:15;APPROX;true;NONE;;;;;t44
a few years ago;NYT19980212.0019;t47;DATE;199X;;true;NONE;;;;;t0
04/02/1998 22:52:00;NYT19980402.0453;t0;TIME;1998-04-02T22:52:00;;false;CREATION_TIME;;;;;
Thursday;NYT19980402.0453;t46;DATE;1998-04-02;;true;NONE;;;;;t0
the last five years;NYT19980402.0453;t48;DURATION;P5Y;;true;NONE;;t0;;;
recent months;NYT19980402.0453;t52;DURATION;PXM;;true;NONE;;t0;;;
last year;NYT19980402.0453;t64;DATE;1997;;true;NONE;;;;;t0
1993;NYT19980402.0453;t63;DATE;1993;;false;NONE;;;;;
Tuesday;NYT19980402.0453;t61;DATE;1998-03-31;;true;NONE;;;;;t0
04/24/1998 21:49:00;NYT19980424.0421;t0;TIME;1998-04-24T21:49:00;;false;CREATION_TIME;;;;;
Saturday, April 25;NYT19980424.0421;t74;DATE;1998-04-25;;true;NONE;;;;;t0
this week;NYT19980424.0421;t75;DATE;1998-W17;;true;NONE;;;;;t0
two years ago;NYT19980424.0421;t76;DATE;1996;;true;NONE;;;;;t0
current;NYT19980424.0421;t77;DATE;PRESENT_REF;;true;NONE;;;;;t0
19980115;PRI19980115.2000.0186;t0;DATE;1998-01-15;;false;CREATION_TIME;;;;;
nineteen ninety-one;PRI19980115.2000.0186;t30;DATE;1991;;false;NONE;;;;;
nineteen ninety-six;PRI19980115.2000.0186;t31;DATE;1996;;false;NONE;;;;;
Now;PRI19980115.2000.0186;t32;DATE;PRESENT_REF;;true;NONE;;;;;t0
19980121;PRI19980121.2000.2591;t0;DATE;1998-01-21;;false;CREATION_TIME;;;;;
today;PRI19980121.2000.2591;t33;DATE;1998-01-21;;true;NONE;;;;;t0
nineteen seventy-nine;PRI19980121.2000.2591;t34;DATE;1979;;false;NONE;;;;;
centuries;PRI19980121.2000.2591;t1982;DURATION;PXC;;false;NONE;;;;;
more than two thousand years;PRI19980121.2000.2591;t1991;DURATION;P2L;MORE_THAN;false;NONE;;;;;
a few minutes;PRI19980121.2000.2591;t1986;DURATION;PXM;;false;NONE;;;;;
19980205;PRI19980205.2000.1890;t0;DATE;1998-02-05;;false;CREATION_TIME;;;;;
now;PRI19980205.2000.1890;t36;DATE;PRESENT_REF;;true;NONE;;;;;t0
19980205;PRI19980205.2000.1998;t0;DATE;1998-02-05;;false;CREATION_TIME;;;;;
today;PRI19980205.2000.1998;t38;DATE;1998-02-05;;true;NONE;;;;;t0
now;PRI19980205.2000.1998;t42;DATE;PRESENT_REF;;true;NONE;;;;;t0
this September;PRI19980205.2000.1998;t44;DATE;1998-09;;true;NONE;;;;;t0
the year two thousand;PRI19980205.2000.1998;t45;DATE;2000;;false;NONE;;;;;
now;PRI19980205.2000.1998;t47;DATE;PRESENT_REF;;true;NONE;;;;;t0
19980213;PRI19980213.2000.0313;t0;DATE;1998-02-13;;false;CREATION_TIME;;;;;
today;PRI19980213.2000.0313;t38;DATE;1998-02-13;;true;NONE;;;;;t0
19980216;PRI19980216.2000.0170;t0;DATE;1998-02-16;;false;CREATION_TIME;;;;;
last week;PRI19980216.2000.0170;t26;DATE;1998-W07;;true;NONE;;;;;t0
19980303;PRI19980303.2000.2550;t0;DATE;1998-03-03;;false;CREATION_TIME;;;;;
Tomorrow;PRI19980303.2000.2550;t135;DATE;1998-03-04;;true;NONE;;;;;t0
now;PRI19980303.2000.2550;t138;DATE;PRESENT_REF;;true;NONE;;;;;t0
tomorrow;PRI19980303.2000.2550;t139;DATE;1998-03-04;;true;NONE;;;;;t0
Now;PRI19980303.2000.2550;t346;DATE;PRESENT_REF;;true;NONE;;;;;t0
one day;PRI19980303.2000.2550;t163;DATE;FUTURE_REF;;true;NONE;;;;;t0
19980306;PRI19980306.2000.1675;t0;DATE;1998-03-06;;false;CREATION_TIME;;;;;
the second day;PRI19980306.2000.1675;t31;DATE;1998-03-06;;true;NONE;;;;;t0
mid afternoon;PRI19980306.2000.1675;t18;TIME;1998-03-06TAF;MID;true;NONE;;;;;t0
the future;PRI19980306.2000.1675;t19;DATE;FUTURE_REF;;true;NONE;;;;;t0
Tuesday, December 3, 1991;SJMN91-06338157;t0;DATE;1991-12-03;;false;CREATION_TIME;;;;;
Monday;SJMN91-06338157;t70;DATE;1991-12-02;;true;NONE;;;;;t0
Wednesday;SJMN91-06338157;t73;DATE;1991-11-27;;true;NONE;;;;;t0
Monday;SJMN91-06338157;t78;DATE;1991-12-02;;true;NONE;;;;;t0
last week;SJMN91-06338157;t81;DATE;1991-W48;;true;NONE;;;;;t0
Monday;SJMN91-06338157;t87;DATE;1991-12-02;;true;NONE;;;;;t0
Sunday;SJMN91-06338157;t88;DATE;1991-12-01;;true;NONE;;;;;t0
19980303;VOA19980303.1600.0917;t0;DATE;1998-03-03;;true;CREATION_TIME;;;;;
two day;VOA19980303.1600.0917;t25;DURATION;P2D;;false;NONE;;;;;
this year;VOA19980303.1600.0917;t26;DATE;1998;;true;NONE;;;;;t0
early Tuesday;VOA19980303.1600.0917;t2221;DATE;1998-03-03;START;true;NONE;;;;;t0
two day;VOA19980303.1600.0917;t28;DURATION;P2D;;false;NONE;;;;;
two days;VOA19980303.1600.0917;t29;DURATION;P2D;;false;NONE;;;;;
19980303;VOA19980303.1600.2745;t0;DATE;1998-03-03;;false;CREATION_TIME;;;;;
the past year;VOA19980303.1600.2745;t168;DATE;1997;;true;NONE;;;;;t0
More recently;VOA19980303.1600.2745;t109;DATE;PAST_REF;;true;NONE;;;;;t0
last year;VOA19980303.1600.2745;t111;DATE;1997;;true;NONE;;;;;t0
the nineties;VOA19980303.1600.2745;t115;DATE;199;;false;NONE;;;;;
this year;VOA19980303.1600.2745;t116;DATE;1998;;true;NONE;;;;;t111
a year;VOA19980303.1600.2745;t120;SET;P1Y;;false;NONE;;;;;
the year two thousand;VOA19980303.1600.2745;t121;DATE;2000;;false;NONE;;;;;
last year;VOA19980303.1600.2745;t126;DATE;1997;;true;NONE;;;;;t0
now;VOA19980303.1600.2745;t129;DATE;PRESENT_REF;;true;NONE;;;;;t0
the past;VOA19980303.1600.2745;t133;DATE;PAST_REF;;true;NONE;;;;;t0
19980305;VOA19980305.1800.2603;t0;DATE;1998-03-05;;false;CREATION_TIME;;;;;
this coming Sunday, March eighth;VOA19980305.1800.2603;t66;DATE;1998-03-08;;true;NONE;;;;;t0
twenty years;VOA19980305.1800.2603;t70;DURATION;P20Y;;false;NONE;;;;;
the past twenty years;VOA19980305.1800.2603;t77;DURATION;P20Y;;true;NONE;;t0;;;
today;VOA19980305.1800.2603;t87;DATE;PRESENT_REF;;true;NONE;;;;;t0
19980331;VOA19980331.1700.1533;t0;DATE;1998-03-31;;false;CREATION_TIME;;;;;
two;VOA19980331.1700.1533;t3000;DURATION;P2D;;;;;;;;
six days;VOA19980331.1700.1533;t3001;DURATION;P6D;;;;;;;;
several years;VOA19980331.1700.1533;t103;DURATION;PXY;;false;NONE;;;;;
a year or two;VOA19980331.1700.1533;t105;DATE;FUTURE_REF;;true;NONE;;;;;t0
the years;VOA19980331.1700.1533;t106;DURATION;PXY;;false;NONE;;;;;
the early years;VOA19980331.1700.1533;t118;DURATION;PXY;;false;NONE;;;;;
each year;VOA19980331.1700.1533;t107;SET;P1Y;;false;NONE;;;EACH;;
five months ago;VOA19980331.1700.1533;t108;DATE;1997-10;;true;NONE;;;;;t0
five months;VOA19980331.1700.1533;t109;DURATION;P5M;;false;NONE;;;;;
19980501;VOA19980501.1800.0355;t0;DATE;1998-05-01;;false;CREATION_TIME;;;;;
next week;VOA19980501.1800.0355;t19;DATE;1998-W19;;true;NONE;;;;;t0
Monday;VOA19980501.1800.0355;t20;DATE;1998-05-04;;true;NONE;;;;;t0
08/13/90;WSJ900813-0157;t0;DATE;1990-08-13;;false;CREATION_TIME;;;;;
yesterday;WSJ900813-0157;t416;DATE;1990-08-12;;true;NONE;;;;;t0
23-year;WSJ900813-0157;t500;DURATION;P23Y;;false;NONE;;;;;
yesterday;WSJ900813-0157;t432;DATE;1990-08-12;;true;NONE;;;;;t0
yesterday;WSJ900813-0157;t437;DATE;1990-08-12;;true;NONE;;;;;t0
Friday;WSJ900813-0157;t443;DATE;1990-08-10;;true;NONE;;;;;t0
yesterday;WSJ900813-0157;t444;DATE;1990-08-12;;true;NONE;;;;;t0
yesterday;WSJ900813-0157;t445;DATE;1990-08-12;;true;NONE;;;;;t0
the weekend;WSJ900813-0157;t447;DATE;1990-W32-WE;;true;NONE;;;;;t0
now;WSJ900813-0157;t1000;DATE;PRESENT_REF;;;;;;;;
the end of the month;WSJ900813-0157;t456;DATE;1990-08-30;;true;NONE;;;;;t0
the past;WSJ900813-0157;t1001;DATE;PAST_REF;;;;;;;;
the weekend;WSJ900813-0157;t458;DATE;1990-W32-WE;;true;NONE;;;;;t0
a few days;WSJ900813-0157;t1002;DURATION;PXD;;;;;;;;
March;WSJ900813-0157;t702;DATE;1990-03;;true;NONE;;;;;t0
02/25/91;WSJ910225-0066;t0;DATE;1991-02-25;;false;CREATION_TIME;;;;;
late yesterday;WSJ910225-0066;t451;DATE;1991-02-24;END;true;NONE;;;;;t0
yesterday;WSJ910225-0066;t463;DATE;1991-02-24;;true;NONE;;;;;t0
the weekend;WSJ910225-0066;t472;DATE;1991-W08-WE;;true;NONE;;;;;t0
Feb. 11;WSJ910225-0066;t494;DATE;1991-02-11;;true;NONE;;;;;t0
a week or so ago;WSJ910225-0066;t496;DATE;1991-02-18;APPROX;true;NONE;;;;;t0
Saturday night;WSJ910225-0066;t498;TIME;1991-02-23TNI;;true;NONE;;;;;t0
a week;WSJ910225-0066;t505;DURATION;P1W;;true;NONE;t507;;;;
noon Saturday;WSJ910225-0066;t507;TIME;1991-02-16T12:00;;true;NONE;;;;;t0
last August;WSJ910225-0066;t508;DATE;1990-08;;true;NONE;;;;;t0
a week;WSJ910225-0066;t518;DURATION;P1W;;false;NONE;;;;;
the four days;WSJ910225-0066;t519;DURATION;P4D;;false;NONE;;;;;
nearly an hour;WSJ910225-0066;t520;DURATION;PT1H;APPROX;false;NONE;;;;;
Saturday night;WSJ910225-0066;t514;TIME;1991-02-16TNI;;true;NONE;;;;;t0
the first hours;WSJ910225-0066;t21;DURATION;PTXH;;;;;;;;
the next few days;WSJ910225-0066;t517;DURATION;PXD;;true;NONE;t0;;;;
eight-year;WSJ910225-0066;t521;DURATION;P8Y;;false;NONE;;;;;
11/02/89;wsj_0006;t0;DATE;1989-11-02;;false;CREATION_TIME;;;;;
year-end;wsj_0006;t10;DATE;1989-12-31;;true;NONE;;;;;t0
11/02/89;wsj_0026;t0;DATE;1989-11-02;;false;CREATION_TIME;;;;;
now;wsj_0026;t38;DATE;PRESENT_REF;;true;NONE;;;;;t0
1988;wsj_0026;t37;DATE;1988;;false;NONE;;;;;
that year;wsj_0026;t1000;DATE;1988;;true;NONE;;;;;t37
11/02/89;wsj_0027;t0;DATE;1989-11-02;;false;CREATION_TIME;;;;;
each of the past three years;wsj_0027;t180;DURATION;P3Y;;true;NONE;;t0;;;
recently;wsj_0027;t66;DATE;PAST_REF;;true;NONE;;;;;t0
52-week;wsj_0027;t68;DURATION;P52W;;false;NONE;;;;;
yesterday;wsj_0027;t69;DATE;1989-11-01;;true;NONE;;;;;t0
last year;wsj_0027;t228;DATE;1988;;true;NONE;;;;;t0
11/02/89;wsj_0032;t0;DATE;1989-11-02;;false;CREATION_TIME;;;;;
today;wsj_0032;t19;DATE;1989-11-02;;true;NONE;;;;;t0
the end of November;wsj_0032;t18;TIME;1989-11;END;true;NONE;;;;;t0
currently;wsj_0032;t17;DATE;PRESENT_REF;;true;NONE;;;;;t0
previously;wsj_0032;t21;TIME;PAST_REF;;true;NONE;;;;;t0
11/02/89;wsj_0068;t0;DATE;1989-11-02;;false;CREATION_TIME;;;;;
Jan. 2;wsj_0068;t18;DATE;1990-01-02;;true;NONE;;;;;t0
Dec. 15;wsj_0068;t17;DATE;1989-12-15;;true;NONE;;;;;t0
third-quarter;wsj_0068;t26;DATE;1989-Q3;;true;NONE;;;;;t0
the year-ago quarter;wsj_0068;t134;DATE;1988-Q3;;true;NONE;;;;;t0
11/02/89;wsj_0073;t0;DATE;1989-11-02;;false;CREATION_TIME;;;;;
the end of this week;wsj_0073;t23;DATE;1989-W44;END;true;NONE;;;;;t0
1993;wsj_0073;t24;DATE;1993;;false;NONE;;;;;
Nov. 21;wsj_0073;t25;DATE;1989-11-21;;true;NONE;;;;;t0
11/02/89;wsj_0106;t0;DATE;1989-11-02;;false;CREATION_TIME;;;;;
11/02/89 ;wsj_0122;t0;DATE;1989-11-02;;false;CREATION_TIME;;;;;
December;wsj_0122;t13;DATE;1989-12;;true;NONE;;;;;t0
11/02/89;wsj_0124;t0;DATE;1989-11-02;;false;CREATION_TIME;;;;;
Nov. 13;wsj_0124;t23;DATE;1989-11-13;;true;NONE;;;;;t0
March;wsj_0124;t27;DATE;1989-03;;true;NONE;;;;;t0
third-quarter;wsj_0124;t29;DATE;1989-Q3;;true;NONE;;;;;t0
a year earlier;wsj_0124;t31;DATE;1988-Q3;;true;NONE;;;;;t29
Sept. 27, 1989;wsj_0124;t36;DATE;1989-11-27;;false;NONE;;;;;
yesterday;wsj_0124;t37;DATE;1989-11-01;;true;NONE;;;;;t0
11/02/89;wsj_0127;t0;DATE;1989-11-02;;false;CREATION_TIME;;;;;
the six months;wsj_0127;t31;DURATION;P6M;;true;NONE;;t25;;;
Oct. 1;wsj_0127;t25;DATE;1989-10-01;;true;NONE;;;;;t0
the latest period;wsj_0127;t26;DATE;1989-Q3;;true;NONE;;;;;t0
1988;wsj_0127;t27;DATE;1998;;false;NONE;;;;;
this year;wsj_0127;t28;DATE;1989;;true;NONE;;;;;t0
last year;wsj_0127;t29;DATE;1988;;true;NONE;;;;;t0
yesterday;wsj_0127;t30;DATE;1989-11-01;;true;NONE;;;;;t0
a year earlier;wsj_0127;t2127;DATE;1988-11-02;;true;NONE;;;;;t0
11/02/89;wsj_0132;t0;DATE;1989-11-02;;false;CREATION_TIME;;;;;
the third quarter;wsj_0132;t36;DATE;1989-Q3;;true;NONE;;;;;t0
a year ago;wsj_0132;t43;DATE;1988;APPROX;true;NONE;;;;;t0
the latest quarter;wsj_0132;t45;DATE;1989-Q3;;true;NONE;;;;;t0
Last year;wsj_0132;t49;DATE;1988;;true;NONE;;;;;t0
11/02/89;wsj_0135;t0;DATE;1989-11-02;;false;CREATION_TIME;;;;;
the year;wsj_0135;t28;DURATION;P1Y;;true;NONE;;t27;;;
June 30, 1990;wsj_0135;t27;DATE;1990-06-30;;false;NONE;;;;;
the current fiscal year;wsj_0135;t30;DATE;1989;;true;NONE;;;;;t28
fiscal 1989;wsj_0135;t32;DATE;1989;;true;NONE;;;;;t30
fiscal 1989;wsj_0135;t35;DATE;1989;;true;NONE;;;;;t32
yesterday;wsj_0135;t37;DATE;1989-11-01;;true;NONE;;;;;t0
11/02/89;wsj_0136;t0;DATE;1989-11-02;;false;CREATION_TIME;;;;;
fourth quarter;wsj_0136;t2027;DATE;1998-Q4;;true;NONE;;;;;t0
Sept. 30;wsj_0136;t2023;DATE;1989-09;;true;NONE;;;;;t0
the fiscal year;wsj_0136;t2024;DATE;1989;;true;NONE;;;;;t0
fiscal 1988;wsj_0136;t37;DATE;1989;;false;NONE;;;;;
11/02/89;wsj_0144;t0;DATE;1989-11-02;;false;CREATION_TIME;;;;;
third-quarter;wsj_0144;t28;DATE;1989-Q3;;true;NONE;;;;;t0
a year ago;wsj_0144;t40;DATE;1988-Q3;;true;NONE;;;;;t28
last month;wsj_0144;t47;DATE;1989-10;;true;NONE;;;;;t0
fourth-quarter;wsj_0144;t48;DATE;1989-Q4;;true;NONE;;;;;t0
the latest quarter;wsj_0144;t52;DATE;1989-Q3;;true;NONE;;;;;t28
a year ago;wsj_0144;t51;DATE;1988-Q3;;true;NONE;;;;;t28
last year;wsj_0144;t56;DATE;1988-Q3;;true;NONE;;;;;t28
the first nine months;wsj_0144;t58;DURATION;P9M;;true;NONE;t59;;;;
the 1988 period;wsj_0144;t59;DATE;1988;;false;NONE;;;;;
year-ago;wsj_0144;t60;DATE;1988;;true;NONE;;;;;t62
the 1988 second quarter;wsj_0144;t62;DATE;1988-Q2;;false;NONE;;;;;
11/02/89;wsj_0150;t0;DATE;1989-11-02;;false;CREATION_TIME;;;;;
currently;wsj_0150;t25;DATE;PRESENT_REF;;true;NONE;;;;;t0
yesterday;wsj_0150;t21;DATE;1989-11-01;;true;NONE;;;;;t0
11/02/89;wsj_0151;t0;DATE;1989-11-02;;false;CREATION_TIME;;;;;
one day;wsj_0151;t60;DURATION;P1D;;false;NONE;;;;;
yesterday;wsj_0151;t58;DATE;1989-11-01;;true;NONE;;;;;t0
11/02/89;wsj_0152;t0;DATE;1989-11-02;;false;CREATION_TIME;;;;;
5 p.m. EST Nov. 9;wsj_0152;t27;TIME;1989-11-09T17:00;;true;NONE;;;;;t0
Nov. 6;wsj_0152;t28;DATE;1989-11-06;;true;NONE;;;;;t0
11/02/89;wsj_0157;t0;DATE;1989-11-02;;false;CREATION_TIME;;;;;
Previously;wsj_0157;t1999;DATE;PAST_REF;;true;NONE;;;;;t0
the first two years;wsj_0157;t28;DURATION;P2Y;;true;NONE;t0;;;;
five years;wsj_0157;t29;DATE;1994;;true;NONE;;;;;t0
11/02/89;wsj_0158;t0;DATE;1989-11-02;;false;CREATION_TIME;;;;;
27-year;wsj_0158;t42;DURATION;P27Y;;false;NONE;;;;;
six months;wsj_0158;t43;DURATION;P6M;;false;NONE;;;;;
several-year;wsj_0158;t44;DURATION;PXY;;false;NONE;;;;;
now;wsj_0158;t46;DATE;PRESENT_REF;;true;NONE;;;;;t0
 11/02/89;wsj_0159;t0;DATE;1989-11-02;;false;CREATION_TIME;;;;;
Nov. 20;wsj_0159;t41;DATE;1989-11-20;;true;NONE;;;;;t0
yesterday;wsj_0159;t44;DATE;1989-11-01;;true;NONE;;;;;t0
already;wsj_0159;t51;DATE;PRESENT_REF;;true;NONE;;;;;t0
Nov. 10;wsj_0159;t52;DATE;1989-11-10;;true;NONE;;;;;t0
11/02/89;wsj_0160;t0;DATE;1989-11-02;;false;CREATION_TIME;;;;;
third-quarter;wsj_0160;t30;DATE;1989-Q3;;true;NONE;;;;;t0
year-earlier;wsj_0160;t31;DATE;1988-Q3;;true;NONE;;;;;t30
the quarter;wsj_0160;t33;DATE;1989-Q3;;true;NONE;;;;;t30
a year earlier;wsj_0160;t38;DATE;1988-Q3;;true;NONE;;;;;t30
11/02/89;wsj_0161;t0;DATE;1989-11-02;;false;CREATION_TIME;;;;;
third-quarter;wsj_0161;t28;DATE;1989-Q3;;true;NONE;;;;;t0
A year earlier;wsj_0161;t31;DATE;1988-Q3;;true;NONE;;;;;t28
11/02/89;wsj_0165;t0;DATE;1989-11-02;;false;CREATION_TIME;;;;;
yesterday;wsj_0165;t27;DATE;1989-11-01;;true;NONE;;;;;t0
11/02/89;wsj_0167;t0;DATE;1989-11-02;;false;CREATION_TIME;;;;;
the third quarter;wsj_0167;t21;DATE;1989-Q3;;true;NONE;;;;;t0
year-earlier;wsj_0167;t22;DATE;1988-Q3;;true;NONE;;;;;t21
the nine months;wsj_0167;t23;DURATION;P9M;;true;NONE;;t21;;;
year-earlier;wsj_0167;t24;DATE;1988;;true;NONE;;;;;t21
11/02/89;wsj_0168;t0;DATE;1989-11-02;;false;CREATION_TIME;;;;;
one-year term;wsj_0168;t23;DURATION;P1Y;;false;NONE;;;;;
an additional year;wsj_0168;t25;DURATION;P1Y;;true;NONE;t0;;;;
11/02/89;wsj_0169;t0;DATE;1989-11-02;;false;CREATION_TIME;;;;;
mid-afternoon yesterday;wsj_0169;t28;TIME;1989-11-01TAF;MID;true;NONE;;;;;t0
Dec. 10;wsj_0169;t36;DATE;1989-12-10;;true;NONE;;;;;t0
already;wsj_0169;t101;DATE;PRESENT_REF;;true;NONE;;;;;t0
11/02/89;wsj_0171;t0;DATE;1989-11-02;;false;CREATION_TIME;;;;;
third-quarter;wsj_0171;t28;DATE;1989-Q3;;true;NONE;;;;;t0
a year ago;wsj_0171;t29;DATE;1988-Q3;;true;NONE;;;;;t28
future;wsj_0171;t30;DATE;FUTURE_REF;;true;NONE;;;;;t0
1990;wsj_0171;t31;DATE;1990;;false;NONE;;;;;
currently;wsj_0171;t2003;DATE;PRESENT_REF;;true;NONE;;;;;t0
the quarter;wsj_0171;t32;DATE;1989-Q3;;true;NONE;;;;;t0
a year ago;wsj_0171;t33;DATE;1988-Q3;;true;NONE;;;;;t32
11/02/89;wsj_0172;t0;DATE;1989-11-02;;false;CREATION_TIME;;;;;
now;wsj_0172;t41;DATE;PRESENT_REF;;true;NONE;;;;;t0
January;wsj_0172;t67;DATE;1990-01;;true;NONE;;;;;t0
early 1990;wsj_0172;t75;DATE;1990;START;false;NONE;;;;;
11/02/89;wsj_0173;t0;DATE;1989-11-02;;false;CREATION_TIME;;;;;
once;wsj_0173;t30;DATE;PAST_REF;;true;NONE;;;;;t0
the early 1980s;wsj_0173;t26;DATE;198;START;false;NONE;;;;;
1983;wsj_0173;t27;DATE;1983;;false;NONE;;;;;
1985;wsj_0173;t28;DATE;1985;;false;NONE;;;;;
July 1988;wsj_0173;t29;DATE;1988-07;;false;NONE;;;;;
11/02/89;wsj_0175;t0;DATE;1989-11-02;;false;CREATION_TIME;;;;;
Tuesday;wsj_0175;t38;DATE;1989-10-31;;true;NONE;;;;;t0
this month;wsj_0175;t34;DATE;1989-11;;true;NONE;;;;;t0
Monday;wsj_0175;t40;DATE;1989-11-06;;true;NONE;;;;;t0
11/02/89;wsj_0176;t0;DATE;1989-11-02;;false;CREATION_TIME;;;;;
early this week;wsj_0176;t21;DATE;1989-W44;START;true;NONE;;;;;t0
the next three quarters;wsj_0176;t23;DURATION;P9M;;true;NONE;t0;;;;
the first nine months;wsj_0176;t24;DURATION;P9M;;false;NONE;;;;;
recent quarters;wsj_0176;t25;DURATION;PXM;;false;NONE;;;;;
11/02/89;wsj_0184;t0;DATE;1989-11-02;;false;CREATION_TIME;;;;;
fourth-quarter;wsj_0184;t79;DURATION;1989-Q4;;true;NONE;;;;;t0
two-year;wsj_0184;t190;DURATION;P2Y;;false;NONE;;;;;
yesterday;wsj_0184;t92;DATE;1989-11-01;;true;NONE;;;;;t0
earlier this year;wsj_0184;t372;DATE;1989;START;true;NONE;;;;;t0
two-year;wsj_0184;t500;DURATION;P2Y;;false;NONE;;;;;
Earlier;wsj_0184;t404;DATE;PAST_REF;;true;NONE;;;;;t0
11/02/89;wsj_0187;t0;DATE;1989-11-02;;false;CREATION_TIME;;;;;
yesterday;wsj_0187;t35;DATE;1989-11-01;;true;NONE;;;;;t0
this week;wsj_0187;t37;DATE;1989-W44;;true;NONE;;;;;t0
Tuesday;wsj_0187;t36;DATE;1989-10-31;;true;NONE;;;;;t0
11/02/89;wsj_0189;t0;DATE;1989-11-02;;false;CREATION_TIME;;;;;
fourth-quarter;wsj_0189;t38;DURATION;1989-Q4;;true;NONE;;;;;t0
a year earlier;wsj_0189;t39;DATE;1988-Q4;;true;NONE;;;;;t38
the latest period;wsj_0189;t42;DATE;1989-Q4;;true;NONE;;;;;t0
last year;wsj_0189;t43;DATE;1988-Q4;;true;NONE;;;;;t42
the year;wsj_0189;t41;DATE;1989;;true;NONE;;;;;t0
Sept. 30;wsj_0189;t40;DATE;1989-09-30;;true;NONE;;;;;t0
This year;wsj_0189;t50;DATE;1989;;true;NONE;;;;;t0
the full year;wsj_0189;t44;DATE;1989;;true;NONE;;;;;t0
recent;wsj_0189;t45;DATE;PAST_REF;;true;NONE;;;;;t0
the next year or so;wsj_0189;t46;DATE;1990;APPROX;true;NONE;;;;;t0
fourth-quarter;wsj_0189;t47;DATE;1989-Q4;;true;NONE;;;;;t0
the year;wsj_0189;t48;DATE;1989;;true;NONE;;;;;t0
yesterday;wsj_0189;t49;DATE;1989-11-01;;true;NONE;;;;;t0
11/01/89;wsj_0263;t0;DATE;1989-11-01;;false;CREATION_TIME;;;;;
Jan. 3;wsj_0263;t17;DATE;1990-01-03;;true;NONE;;;;;t0
Nov. 16;wsj_0263;t18;DATE;1989-11-16;;true;NONE;;;;;t0
the fourth quarter;wsj_0263;t20;DATE;1989-Q4;;true;NONE;;;;;t19
Aug. 26;wsj_0263;t19;DATE;1989-08-26;;true;NONE;;;;;t0
A year earlier;wsj_0263;t2096;DATE;1988-11-01;APPROX;true;NONE;;;;;t0
11/01/89;wsj_0266;t0;DATE;1989-11-01;;false;CREATION_TIME;;;;;
Oct. 23;wsj_0266;t42;DATE;1989-10-23;;true;NONE;;;;;t0
about two years ago;wsj_0266;t39;DURATION;P2Y;APPROX;false;NONE;;t42;;;
the 20th century;wsj_0266;t40;DATE;19XX;;false;NONE;;;;;
11/01/89;wsj_0292;t0;DATE;1989-11-01;;false;CREATION_TIME;;;;;
third-quarter;wsj_0292;t82;DATE;1989-Q3;;true;NONE;;;;;t0
a year ago;wsj_0292;t78;DATE;1988-Q3;;true;NONE;;;;;t82
a flat second quarter;wsj_0292;t79;DATE;1989-Q2;;true;NONE;;;;;t0
the year-earlier period;wsj_0292;t85;DATE;1988-Q3;;true;NONE;;;;;t82
the 1989 period;wsj_0292;t86;DATE;1989-Q3;;true;NONE;;;;;t82
a year ago;wsj_0292;t87;DATE;1988-Q3;;true;NONE;;;;;t86
the first nine months;wsj_0292;t88;DURATION;P9M;;true;NONE;;t0;;;
11/01/89;wsj_0313;t0;DATE;1989-11-01;;false;CREATION_TIME;;;;;
the third quarter;wsj_0313;t62;DATE;1989-Q3;;true;NONE;;;;;t0
the third quarter;wsj_0313;t63;DURATION;1989-Q3;;true;NONE;;;;;t0
a year ago;wsj_0313;t65;DATE;1988-Q3;;true;NONE;;;;;t63
The latest period;wsj_0313;t66;DATE;1989-Q3;;true;NONE;;;;;t0
the near future;wsj_0313;t67;DATE;FUTURE_REF;;true;NONE;;;;;t0
11/01/89;wsj_0316;t0;DATE;1989-11-01;;false;CREATION_TIME;;;;;
early next year;wsj_0316;t16;DATE;1990;START;true;NONE;;;;;t0
11/01/89;wsj_0321;t0;DATE;1989-11-01;;false;CREATION_TIME;;;;;
yesterday;wsj_0321;t41;DATE;1989-10-31;;true;NONE;;;;;t0
11/01/89 ;wsj_0324;t0;DATE;1989-11-01;;false;CREATION_TIME;;;;;
now;wsj_0324;t49;DATE;PRESENT_REF;;true;NONE;;;;;t0
last year;wsj_0324;t64;DATE;1988;;true;NONE;;;;;t0
11/01/89 ;wsj_0325;t0;DATE;1989-11-01;;false;CREATION_TIME;;;;;
third-quarter;wsj_0325;t31;DATE;1989-Q3;;true;NONE;;;;;t0
the quarter;wsj_0325;t48;DATE;1989-Q3;;true;NONE;;;;;t31
Sept. 30;wsj_0325;t32;DATE;1989-09-30;;true;NONE;;;;;t0
the year-ago quarter;wsj_0325;t49;DATE;1988-Q3;;true;NONE;;;;;t31
year-ago;wsj_0325;t51;DATE;1988-Q3;;true;NONE;;;;;t49
the third quarter;wsj_0325;t52;DATE;1989-Q3;;true;NONE;;;;;t31
11/01/89;wsj_0329;t0;DATE;1989-11-01;;false;CREATION_TIME;;;;;
three years;wsj_0329;t21;DURATION;P3Y;;false;NONE;;;;;
each month;wsj_0329;t22;SET;P1M;;false;NONE;;;each;;
11/01/89;wsj_0332;t0;DATE;1989-11-01;;false;CREATION_TIME;;;;;
last Wednesday;wsj_0332;t50;DATE;1989-10-25;;true;NONE;;;;;t0
11/01/89;wsj_0340;t0;DATE;1989-11-01;;false;CREATION_TIME;;;;;
Earlier yesterday;wsj_0340;t23;DATE;1989-10-31;START;true;NONE;;;;;t0
last week;wsj_0340;t61;DATE;1989-WXX;;true;NONE;;;;;t0
Monday;wsj_0340;t26;DATE;1989-11-06;;true;NONE;;;;;t0
11/01/89;wsj_0344;t0;DATE;1989-11-01;;false;CREATION_TIME;;;;;
the third quarter;wsj_0344;t41;DATE;1989-Q3;;true;NONE;;;;;t0
Sept. 30;wsj_0344;t42;DATE;1989-09-30;;true;NONE;;;;;t0
the corresponding period last year;wsj_0344;t46;DATE;1988-Q3;;true;NONE;;;;;t41
This quarter;wsj_0344;t47;DATE;1989-Q3;;true;NONE;;;;;t41
this year's third quarter;wsj_0344;t49;DATE;1989-Q3;;true;NONE;;;;;t0
last year;wsj_0344;t53;DATE;1988;;true;NONE;;;;;t0
last year's quarter;wsj_0344;t58;DATE;1988-Q3;;true;NONE;;;;;t41
11/01/89;wsj_0346;t0;DATE;1989-11-01;;false;CREATION_TIME;;;;;
the year;wsj_0346;t33;DURATION;P1Y;;true;NONE;;t32;;;
March 31;wsj_0346;t32;DATE;1989-03-31;;true;NONE;;;;;t0
currently;wsj_0346;t34;DATE;PRESENT_REF;;true;NONE;;;;;t0
11/01/89;wsj_0348;t0;DATE;1989-11-01;;false;CREATION_TIME;;;;;
the third quarter;wsj_0348;t29;DATE;1989-Q3;;true;NONE;;;;;t0
a year ago;wsj_0348;t89;DATE;1988-Q3;;true;NONE;;;;;t29
August;wsj_0348;t37;DATE;1989-08;;true;NONE;;;;;t0
yesterday;wsj_0348;t38;DATE;1989-10-31;;true;NONE;;;;;t0
this summer;wsj_0348;t41;DATE;1989-SU;;true;NONE;;;;;t0
a year ago;wsj_0348;t158;DATE;1988-11;;true;NONE;;;;;t0
third-quarter;wsj_0348;t52;DATE;1989-Q3;;true;NONE;;;;;t0
a year;wsj_0348;t55;DATE;1988-Q3;;true;NONE;;;;;t52
11/01/89;wsj_0356;t0;DATE;1989-11-01;;false;CREATION_TIME;;;;;
Earlier this month;wsj_0356;t23;DATE;1989-11;START;true;NONE;;;;;t0
10/31/89;wsj_0376;t0;DATE;1989-10-31;;false;CREATION_TIME;;;;;
next year's first quarter;wsj_0376;t90;DATE;1990-Q1;;true;NONE;;;;;t0
the year;wsj_0376;t99;DURATION;P1Y;;true;NONE;;t100;;;
March 31;wsj_0376;t100;DATE;1989-03-31;;true;NONE;;;;;t0
last year;wsj_0376;t108;DATE;1988;;true;NONE;;;;;t0
10/31/89 ;wsj_0471;t0;DATE;1989-10-31;;false;CREATION_TIME;;;;;
Earlier this year;wsj_0471;t39;DATE;1989;START;true;NONE;;;;;t0
last week;wsj_0471;t40;DATE;1989-W43;;true;NONE;;;;;t0
10/31/89;wsj_0505;t0;DATE;1989-10-31;;false;CREATION_TIME;;;;;
yesterday;wsj_0505;t42;DATE;1989-10-30;;true;NONE;;;;;t0
Dec. 15;wsj_0505;t45;DATE;1989-12-15;;true;NONE;;;;;t0
the fiscal year;wsj_0505;t47;DURATION;P1Y;;true;NONE;;t48;;;
Jan. 31;wsj_0505;t48;DATE;1989-01-31;;true;NONE;;;;;t0
1992;wsj_0505;t60;DATE;1992;;false;NONE;;;;;
currently;wsj_0505;t62;DATE;PRESENT_REF;;true;NONE;;;;;t0
10/30/89;wsj_0520;t0;DATE;1989-10-30;;false;CREATION_TIME;;;;;
six months;wsj_0520;t77;DURATION;P6M;;false;NONE;;;;;
the year;wsj_0520;t88;DATE;1989;;true;NONE;;;;;t0
June;wsj_0520;t89;DATE;1989-06;;true;NONE;;;;;t0
March;wsj_0520;t90;DATE;1989-03;;true;NONE;;;;;t0
this year;wsj_0520;t92;DATE;1989-10-30;;true;NONE;;;;;t0
the first nine months;wsj_0520;t100;DURATION;P9M;;false;NONE;;;;;
the year;wsj_0520;t1000;DATE;1989;;true;;;;;;t0
recently;wsj_0520;t101;DATE;PAST_REF;;true;NONE;;;;;t0
Friday;wsj_0520;t103;DATE;1989-10-27;;true;NONE;;;;;t0
1987;wsj_0520;t109;DATE;1987;;false;NONE;;;;;
Sept. 29;wsj_0520;t111;DATE;1989-09-29;;true;NONE;;;;;t0
this year;wsj_0520;t112;DATE;1989;;true;NONE;;;;;t0
10/30/89;wsj_0527;t0;DATE;1989-10-30;;false;CREATION_TIME;;;;;
Dec. 7;wsj_0527;t85;DATE;1989-12-07;;true;NONE;;;;;t0
Friday;wsj_0527;t86;DATE;1989-10-27;;true;NONE;;;;;t0
1989;wsj_0527;t89;DATE;1989;;false;NONE;;;;;
early November;wsj_0527;t191;DATE;1989-11;START;true;NONE;;;;;t0
third-quarter;wsj_0527;t92;DATE;1989-Q3;;true;NONE;;;;;t0
a year ago;wsj_0527;t95;DATE;1988-Q3;;true;NONE;;;;;t92
third-quarter;wsj_0527;t98;DATE;1989-Q3;;true;NONE;;;;;t0
the third quarter;wsj_0527;t105;DATE;1989-Q3;;true;NONE;;;;;t0
the third quarter;wsj_0527;t104;DATE;1989-Q3;;true;NONE;;;;;t0
a year ago;wsj_0527;t111;DATE;1988-Q3;;true;NONE;;;;;t104
Third-quarter;wsj_0527;t116;DATE;1989-Q3;;true;NONE;;;;;t0
a year ago;wsj_0527;t122;DATE;1988-Q3;;true;NONE;;;;;t0
10/30/89;wsj_0533;t0;DATE;1989-10-30;;false;CREATION_TIME;;;;;
Friday;wsj_0533;t102;DATE;1989-10-27;;true;NONE;;;;;t0
last Thursday;wsj_0533;t103;DATE;1989-10-26;;true;NONE;;;;;t0
Nov. 6;wsj_0533;t104;DATE;1989-11-06;;true;NONE;;;;;t0
Nov. 16;wsj_0533;t107;DATE;1989-11-16;;true;NONE;;;;;t0
Friday evening;wsj_0533;t112;TIME;1989-10-27TEV;;true;NONE;;;;;t0
mid-November;wsj_0533;t122;DATE;1989-11;MID;true;NONE;;;;;t0
last week;wsj_0533;t124;DATE;1989-WXX;;true;NONE;;;;;t0
Thursday;wsj_0533;t127;DATE;1989-10-26;;true;NONE;;;;;t0
Thursday;wsj_0533;t128;DATE;1989-10-26;;true;NONE;;;;;t0
10/30/89;wsj_0534;t0;DATE;1989-10-30;;false;CREATION_TIME;;;;;
Dec. 7;wsj_0534;t15;DATE;1989-12-07;;true;NONE;;;;;t0
Nov. 30;wsj_0534;t18;DATE;1989-11-30;;true;NONE;;;;;t0
then;wsj_0534;t22;DATE;1989-11-30;;true;NONE;;;;;t18
Friday;wsj_0534;t19;DATE;1989-10-27;;true;NONE;;;;;t0
10/30/89;wsj_0541;t0;DATE;1989-10-30;;false;CREATION_TIME;;;;;
Nov. 16;wsj_0541;t18;DATE;1989-11-16;;true;NONE;;;;;t0
March 1, 2011;wsj_0541;t20;DATE;2011-03-01;;false;NONE;;;;;
Friday;wsj_0541;t21;DATE;1989-10-27;;true;NONE;;;;;t0
last Monday;wsj_0541;t24;DATE;1989-10-23;;true;NONE;;;;;t0
10/30/89;wsj_0542;t0;DATE;1989-10-30;;false;CREATION_TIME;;;;;
5 p.m. EST, Nov. 6;wsj_0542;t87;TIME;1989-11-06T17;;true;NONE;;;;;t0
midnight Friday;wsj_0542;t90;TIME;1989-10-27T24;;true;NONE;;;;;t0
last Friday;wsj_0542;t91;DATE;1989-10-27;;true;NONE;;;;;t0
Sept. 26;wsj_0542;t94;DATE;1989-09-26;;true;NONE;;;;;t0
Friday;wsj_0542;t98;DATE;1989-10-27;;true;NONE;;;;;t0
Late last week;wsj_0542;t102;DATE;1989-WXX;END;true;NONE;;;;;t0
10/30/89;wsj_0551;t0;DATE;1989-10-30;;false;CREATION_TIME;;;;;
June;wsj_0551;t15;DATE;1989-06;;true;NONE;;;;;t0
around year end;wsj_0551;t17;DATE;1989-12;APPROX;true;NONE;;;;;t0
10/30/89;wsj_0555;t0;DATE;1989-10-30;;false;CREATION_TIME;;;;;
March 15, 2007;wsj_0555;t13;DATE;2007-03-15;;false;NONE;;;;;
10/30/89;wsj_0557;t0;DATE;1989-10-30;;false;CREATION_TIME;;;;;
last year;wsj_0557;t79;DATE;1988;;true;NONE;;;;;t0
last December;wsj_0557;t82;DATE;1988-12;;true;NONE;;;;;t0
February;wsj_0557;t85;DATE;1990-02;;true;NONE;;;;;t0
February;wsj_0557;t91;DATE;1989-02;;true;NONE;;;;;t0
Friday;wsj_0557;t95;DATE;1989-10-27;;true;NONE;;;;;t0
Friday;wsj_0557;t99;DATE;1989-10-27;;true;NONE;;;;;t0
10/30/89;wsj_0558;t0;DATE;1989-10-30;;false;CREATION_TIME;;;;;
third-quarter;wsj_0558;t44;DATE;1989-Q3;;true;NONE;;;;;t0
Last year;wsj_0558;t49;DATE;1988;;true;NONE;;;;;t0
year-earlier;wsj_0558;t52;DATE;1988;;true;NONE;;;;;t0
nearly two weeks ago;wsj_0558;t57;DATE;1989-WXX;EQUAL_OR_LESS;true;NONE;;;;;t0
fourth-quarter;wsj_0558;t61;DATE;1989-Q4;;true;NONE;;;;;t0
Friday;wsj_0558;t63;DATE;1989-10-27;;true;NONE;;;;;t0
the latest quarter;wsj_0558;t65;DATE;1989-Q3;;true;NONE;;;;;t0
last year;wsj_0558;t69;DATE;1988-Q3;;true;NONE;;;;;t65
nearly three years;wsj_0558;t73;DURATION;P3Y;LESS_THAN;false;NONE;;;;;
Third-quarter;wsj_0558;t75;DATE;1989-Q3;;true;NONE;;;;;t0
August;wsj_0558;t80;DATE;1989-08;;true;NONE;;;;;t0
the nine months;wsj_0558;t81;DURATION;P9M;;false;NONE;;;;;
last year;wsj_0558;t85;DATE;1988;;true;NONE;;;;;t0
10/30/89;wsj_0568;t0;DATE;1989-10-30;;false;CREATION_TIME;;;;;
Friday;wsj_0568;t209;DATE;1989-10-27;;true;NONE;;;;;t0
the third quarter;wsj_0568;t211;DATE;1989-Q3;;true;NONE;;;;;t0
next year;wsj_0568;t214;DATE;1990;;true;NONE;;;;;t0
the quarter;wsj_0568;t2135;DATE;1989-Q3;;true;NONE;;;;;t211
the year-earlier quarter;wsj_0568;t225;DATE;1988-Q3;;true;NONE;;;;;t211
a month ago;wsj_0568;t228;DATE;1989-09;;true;NONE;;;;;t0
the quarter;wsj_0568;t235;DATE;1989-Q3;;true;NONE;;;;;t211
future quarters;wsj_0568;t237;DATE;FUTURE_REF;;true;NONE;;;;;t0
the quarter;wsj_0568;t239;DATE;1989-Q3;;true;NONE;;;;;t211
the end of the year;wsj_0568;t243;DATE;1989;END;true;NONE;;;;;t0
the quarter;wsj_0568;t246;DATE;1989-Q3;;true;NONE;;;;;t211
the past several quarters;wsj_0568;t249;DATE;PAST_REF;;false;NONE;;;;;
every quarter;wsj_0568;t256;SET;P1Q;;false;NONE;;;every;;
next year;wsj_0568;t259;DATE;1990;;true;NONE;;;;;t0
the near term;wsj_0568;t1998;DATE;FUTURE_REF;;true;NONE;;;;;t0
this year;wsj_0568;t2000;DATE;1989;;true;NONE;;;;;t0
this year;wsj_0568;t2003;DATE;1989;;true;NONE;;;;;t0
last year;wsj_0568;t2008;DATE;1988;;true;NONE;;;;;t0
Friday;wsj_0568;t2009;DATE;1989-10-27;;true;NONE;;;;;t0
the first nine months;wsj_0568;t2012;DURATION;P9M;;true;NONE;;t0;;;
a year;wsj_0568;t2013;DATE;1988;;true;NONE;;;;;t0
the fourth quarter;wsj_0568;t2021;DATE;1989-Q4;;true;NONE;;;;;t0
next year;wsj_0568;t2022;DATE;1990;;true;NONE;;;;;t0
next year;wsj_0568;t2029;DATE;1990;;true;NONE;;;;;t0
next year;wsj_0568;t2034;DATE;1990;;true;NONE;;;;;t0
Friday;wsj_0568;t2038;DATE;1989-10-27;;true;NONE;;;;;t0
10/30/89;wsj_0570;t0;DATE;1989-10-30;;false;CREATION_TIME;;;;;
the past;wsj_0570;t84;DATE;PAST_REF;;true;NONE;;;;;t0
from time to time;wsj_0570;t88;DATE;FUTURE_REF;;true;NONE;;;;;t0
Sept. 14;wsj_0570;t91;DATE;1989-09-14;;true;NONE;;;;;t0
Thursday;wsj_0570;t92;DATE;1989-10-26;;true;NONE;;;;;t0
Friday;wsj_0570;t94;DATE;1989-10-27;;true;NONE;;;;;t0
recently;wsj_0570;t100;DATE;PAST_REF;;true;NONE;;;;;t0
May;wsj_0570;t101;DATE;1989-05;;true;NONE;;;;;t0
February;wsj_0570;t104;DATE;1990-02;;true;NONE;;;;;t0
early September;wsj_0570;t105;DATE;1989-09;START;true;NONE;;;;;t0
July;wsj_0570;t108;DATE;1989-07;;true;NONE;;;;;t0
recent;wsj_0570;t110;DATE;PAST_REF;;true;NONE;;;;;t0
Earlier this month;wsj_0570;t113;DATE;1989-10;START;true;NONE;;;;;t0
the next four years;wsj_0570;t114;DURATION;P4Y;;true;NONE;t0;;;;
the nine months;wsj_0570;t115;DURATION;P9M;;false;NONE;;;;;
10/30/89;wsj_0575;t0;DATE;1989-10-30;;false;CREATION_TIME;;;;;
months ago;wsj_0575;t204;DURATION;PXM;;true;NONE;;t0;;;
soon;wsj_0575;t206;DATE;FUTURE_REF;;false;NONE;;;;;
now;wsj_0575;t2041;DATE;PRESENT_REF;;true;NONE;;;;;t0
five-year;wsj_0575;t209;DURATION;P5Y;;false;NONE;;;;;
that time;wsj_0575;t213;DURATION;P5Y;;true;NONE;;;;;t209
this year;wsj_0575;t2110;DATE;1989;;true;NONE;;;;;t0
next year;wsj_0575;t218;DATE;1990;;true;NONE;;;;;t0
recent;wsj_0575;t222;DATE;PAST_REF;;true;NONE;;;;;t0
1990;wsj_0575;t224;DATE;1990;;false;NONE;;;;;
a good part of 1990;wsj_0575;t228;DATE;1990;;false;NONE;;;;;
next year;wsj_0575;t229;DATE;1990;;true;NONE;;;;;t0
recent months;wsj_0575;t232;DURATION;PXM;;true;NONE;;t0;;;
January;wsj_0575;t237;DATE;1990-01;;true;NONE;;;;;t0
Last week;wsj_0575;t238;DATE;1989-WXX;;true;NONE;;;;;t0
third-quarter;wsj_0575;t239;DATE;1989-Q3;;true;NONE;;;;;t0
the first nine months;wsj_0575;t241;DURATION;P9M;;true;NONE;;t0;;;
recently;wsj_0575;t1991;DATE;PAST_REF;;true;NONE;;;;;t0
several quarters;wsj_0575;t1994;DURATION;PXQ;;false;NONE;;;;;
recently;wsj_0575;t1995;DATE;PAST_REF;;true;NONE;;;;;t0
the end of 1990;wsj_0575;t2000;DATE;1990;END;false;NONE;;;;;
this past spring;wsj_0575;t2001;DATE;1989-SP;;true;NONE;;;;;t0
10/30/89;wsj_0583;t0;DATE;1989-10-30;;false;CREATION_TIME;;;;;
Friday;wsj_0583;t200;DATE;1989-10-27;;true;NONE;;;;;t0
the year;wsj_0583;t204;DURATION;P1Y;;true;NONE;;t205;;;
tomorrow;wsj_0583;t205;DATE;1989-10-31;;true;NONE;;;;;t0
currently;wsj_0583;t207;DATE;PRESENT_REF;;true;NONE;;;;;t0
this year;wsj_0583;t211;DATE;1989;;true;NONE;;;;;t0
recent years;wsj_0583;t216;DATE;PXY;;true;NONE;;t0;;;
recent years;wsj_0583;t217;DATE;PAST_REF;;true;NONE;;;;;t0
the future;wsj_0583;t228;DATE;FUTURE_REF;;true;NONE;;;;;t0
1980;wsj_0583;t235;DATE;1980;;false;NONE;;;;;
September;wsj_0583;t239;DATE;1989-09;;true;NONE;;;;;t0
Last month;wsj_0583;t241;DATE;1989-09;;true;NONE;;;;;t0
10/30/89;wsj_0584;t0;DATE;1989-10-30;;false;CREATION_TIME;;;;;
the short term;wsj_0584;t287;DATE;FUTURE_REF;;true;NONE;;;;;t0
Friday;wsj_0584;t288;DATE;1989-10-27;;true;NONE;;;;;t0
earlier this month;wsj_0584;t292;DATE;1989-10;START;true;NONE;;;;;t0
1994 or later;wsj_0584;t299;DATE;1994;ON_OR_AFTER;false;NONE;;;;;
the weekend;wsj_0584;t307;DATE;1989-W43-WE;;true;NONE;;;;;t0
June 1994;wsj_0584;t322;DATE;1994-06;;false;NONE;;;;;
five years;wsj_0584;t326;DURATION;P5Y;;false;NONE;;;;;
1990;wsj_0584;t351;DATE;1990;;false;NONE;;;;;
1991;wsj_0584;t352;DATE;1991;;false;NONE;;;;;
1988;wsj_0584;t358;DATE;1988;;false;NONE;;;;;
1990;wsj_0584;t359;DATE;1990;;false;NONE;;;;;
now;wsj_0584;t361;DATE;PRESENT_REF;;true;NONE;;;;;t0
Friday;wsj_0584;t364;DATE;1989-10-27;;true;NONE;;;;;t0
1984;wsj_0584;t370;DATE;1984;;false;NONE;;;;;
10/30/89;wsj_0585;t0;DATE;1989-10-30;;false;CREATION_TIME;;;;;
September;wsj_0585;t295;DATE;1989-09;;true;NONE;;;;;t0
this month;wsj_0585;t303;DATE;1989-10;;true;NONE;;;;;t0
now;wsj_0585;t311;DATE;PRESENT_REF;;true;NONE;;;;;t0
past years;wsj_0585;t320;DATE;PAST_REF;;true;NONE;;;;;t0
these days;wsj_0585;t321;DATE;PRESENT_REF;;true;NONE;;;;;t0
1987;wsj_0585;t323;DATE;1987;;false;NONE;;;;;
Eight trading days;wsj_0585;t336;DURATION;P8D;EQUAL_OR_MORE;false;NONE;t335;;;;
Oct. 12;wsj_0585;t335;DATE;1989-10-12;;true;NONE;;;;;t0
the day;wsj_0585;t338;DATE;1989-10-12;;true;NONE;;;;;t335
Three days;wsj_0585;t341;DURATION;P3D;;false;NONE;;t340;;;
Friday;wsj_0585;t340;DATE;1989-10-27;;true;NONE;;;;;t0
Friday;wsj_0585;t356;DATE;1989-10-27;;true;NONE;;;;;t0
the week;wsj_0585;t357;DATE;1989-WXX;;true;NONE;;;;;t0
Friday;wsj_0585;t362;DATE;1989-10-27;;true;NONE;;;;;t0
Friday;wsj_0585;t365;DATE;1989-10-27;;true;NONE;;;;;t0
October;wsj_0585;t366;DATE;1989-10;;true;NONE;;;;;t0
now;wsj_0585;t368;DATE;PRESENT_REF;;true;NONE;;;;;t0
Thursday;wsj_0585;t1082;DATE;1989-10-26;;true;NONE;;;;;t0
two to three weeks;wsj_0585;t1111;DURATION;P2W;EQUAL_OR_MORE;false;NONE;;;;;
third-quarter;wsj_0585;t380;DATE;1989-Q3;;true;NONE;;;;;t0
last year;wsj_0585;t387;DATE;1988;;true;NONE;;;;;t0
the 1988 quarter;wsj_0585;t386;DATE;1988-Q3;;true;NONE;;;;;t380
10/30/89;wsj_0586;t0;DATE;1989-10-30;;false;CREATION_TIME;;;;;
Friday;wsj_0586;t199;DATE;1989-10-27;;true;NONE;;;;;t0
overnight;wsj_0586;t207;TIME;1989-10-26TNI;;true;NONE;;;;;t199
the previous Friday;wsj_0586;t215;DATE;1989-10-20;;true;NONE;;;;;t0
Oct. 13;wsj_0586;t217;DATE;1989-10-13;;true;NONE;;;;;t0
current;wsj_0586;t218;DATE;PRESENT_REF;;true;NONE;;;;;t0
Thursday;wsj_0586;t225;DATE;1989-10-26;;true;NONE;;;;;t0
the week;wsj_0586;t226;DATE;1989-WXX;;true;NONE;;;;;t0
two-week;wsj_0586;t230;DURATION;P2W;;false;NONE;;;;;
Friday;wsj_0586;t231;DATE;1989-10-27;;true;NONE;;;;;t0
one day;wsj_0586;t247;DURATION;P1D;;false;NONE;;;;;
this week;wsj_0586;t264;DATE;1989-W44;;true;NONE;;;;;t0
Monday;wsj_0586;t269;DATE;1989-10-30;;true;NONE;;;;;t0
Friday;wsj_0586;t274;DATE;1989-10-27;;true;NONE;;;;;t0
Thursday;wsj_0586;t275;DATE;1989-10-26;;true;NONE;;;;;t0
recent;wsj_0586;t280;DATE;PAST_REF;;true;NONE;;;;;t0
Friday;wsj_0586;t281;DATE;1989-10-27;;true;NONE;;;;;t0
the morning;wsj_0586;t282;TIME;1989-10-27TMO;;true;NONE;;;;;t281
day;wsj_0586;t941;DURATION;P1D;;false;NONE;;;;;
November;wsj_0586;t283;DATE;1989-11;;true;NONE;;;;;t0
this week;wsj_0586;t287;DATE;1989-W44;;true;NONE;;;;;t0
Friday;wsj_0586;t288;DATE;1989-10-27;;true;NONE;;;;;t0
the week;wsj_0586;t293;DATE;1989-WXX;;true;NONE;;;;;t0
Friday;wsj_0586;t294;DATE;1989-10-27;;true;NONE;;;;;t0
the past five days;wsj_0586;t298;DURATION;P5D;;true;NONE;;t0;;;
a week;wsj_0586;t301;DURATION;P1W;;true;NONE;;;;;t0
Friday;wsj_0586;t302;DATE;1989-10-27;;true;NONE;;;;;t0
Friday;wsj_0586;t316;DATE;1989-10-27;;true;NONE;;;;;t0
the weekend;wsj_0586;t322;DATE;1989-W44-WE;;true;NONE;;;;;t0
last week;wsj_0586;t326;DATE;1989-W43;;true;NONE;;;;;t0
year-end;wsj_0586;t341;DATE;1988-12-31;;true;NONE;;;;;t0
10/30/89;wsj_0610;t0;DATE;1989-10-30;;false;CREATION_TIME;;;;;
now;wsj_0610;t296;DATE;PRESENT_REF;;true;NONE;;;;;t0
current;wsj_0610;t193;DATE;PRESENT_REF;;true;NONE;;;;;t0
1993;wsj_0610;t196;DATE;1993;;false;NONE;;;;;
current;wsj_0610;t200;DATE;PRESENT_REF;;true;NONE;;;;;t0
this year;wsj_0610;t419;DATE;1989;;true;NONE;;;;;t0
soon;wsj_0610;t207;DATE;FUTURE_REF;;true;NONE;;;;;t0
right now;wsj_0610;t209;DATE;PRESENT_REF;;true;NONE;;;;;t0
recently;wsj_0610;t210;DATE;PAST_REF;;true;NONE;;;;;t0
Friday;wsj_0610;t211;DATE;1989-10-27;;true;NONE;;;;;t0
this year;wsj_0610;t214;DATE;1989;;true;NONE;;;;;t0
the next two years or so;wsj_0610;t220;DURATION;P2Y;APPROX;true;NONE;;t0;;;
1989;wsj_0610;t226;DATE;1989;;false;NONE;;;;;
next year;wsj_0610;t230;DATE;1990;;true;NONE;;;;;t0
next year;wsj_0610;t233;DATE;1990;;true;NONE;;;;;t0
recent weeks;wsj_0610;t248;DURATION;PXW;;true;NONE;;t0;;;
Last Friday;wsj_0610;t251;DATE;1989-10-27;;true;NONE;;;;;t0
recently;wsj_0610;t257;DATE;PAST_REF;;true;NONE;;;;;t0
1992;wsj_0610;t258;DATE;1992;;false;NONE;;;;;
the full year;wsj_0610;t264;DATE;1989;;true;NONE;;;;;t0
Last year;wsj_0610;t265;DATE;1988;;true;NONE;;;;;t0
third-quarter;wsj_0610;t268;DATE;1989-Q3;;true;NONE;;;;;t0
the latest quarter;wsj_0610;t279;DATE;1989-Q3;;true;NONE;;;;;t0
10/30/89;wsj_0612;t0;DATE;1989-10-30;;false;CREATION_TIME;;;;;
Friday;wsj_0612;t29;DATE;1989-10-27;;true;NONE;;;;;t0
Oct. 15, 1999;wsj_0612;t32;DATE;1999-10-15;;false;NONE;;;;;
Thursday;wsj_0612;t33;DATE;1989-10-26;;true;NONE;;;;;t0
Nov. 1, 2009;wsj_0612;t37;DATE;2009-11-01;;false;NONE;;;;;
1999;wsj_0612;t44;DATE;1999;;false;NONE;;;;;
10-year;wsj_0612;t500;DURATION;P10Y;;false;NONE;;;;;
Nov. 17, 1992;wsj_0612;t47;DATE;1992-11-17;;false;NONE;;;;;
10/30/89;wsj_0637;t0;DATE;1989-10-30;;false;CREATION_TIME;;;;;
around Nov. 1;wsj_0637;t72;DATE;1989-11-01;APPROX;true;NONE;;;;;t0
30-day;wsj_0637;t500;DURATION;P30D;;false;NONE;;;;;
Dec. 31, 1994;wsj_0637;t37;DATE;1994-12-31;;false;NONE;;;;;
the end of 1994;wsj_0637;t42;DATE;1994;END;false;NONE;;;;;
